"Company Name","Url Link","Keyword Selected","Phone","Email","Address","Person Name"
"Babysitter-Express","https://www.babysitter-express.de/en/babysitter-vermittlungsagentur","babysitter","49 30 4000 3 400, 49 160 97 220 665","kontakt@babysitter-express.de","","Babysitter Unternehmensservice Unternehmen, Spielzimmerbetreuung, Firmenkunden Prices, Click, Jump, Lieblingstipps, Fast, Beautiful, Fast, Beautiful, Contact Wir, Berlin, Babysitter Service Request Futher, Hygienekonzept, Privatkunden Hygienekonzept, Firmenkunden Referenzen Impressum Datenschutz AGB, Widerrufsbelehrung"
"Agenturmarypoppins","https://www.agenturmarypoppins.de/babysitter/","babysitter","","","","Babysitter, Agentur Mary Poppins Home Leistungen Standorte Stellenangebote Franchise Seite, Babysitter Deutschlands Mütter, Mary Poppins, Mit Mary Poppins, Sie Ihren Babysitter, Wir, Treffen, Suche, Ihrer Arbeitszeit, Stunden, Abend, Freizeit, Babysitter, Ihrer Abwesenheit, Bei, Auswahl, Wert, Erfahrung, Babysitter, Mary Poppins, Mit Sicherheit, Eine Buchung, Agentur Mary Poppins, Ihnen, Kinderbetreuung, Vermittlungsagentur, Babysitter, Ihnen, Erst, Gesprächen, Lebenslaufs, Erfahrung, Auswahlmethode, Ihnen, Sollte Ihr Babysitter, Ersatz, Babysitter, Berlin Bielefeld Bonn Braunschweig Bremen Darmstadt Düsseldorf Essen Frankfurt Freiburg Hamburg Heidelberg Karlsruhe Kiel Köln Leipzig München Nürnberg Osnabrück Potsdam Rostock Stuttgart Aktuelle, Erfolgreich, Mary PoppinsMehr Infos, Poppins NewsErfahren Sie Neuigkeiten, Mary Poppins, Poppins ÖsterreichZur Webseite Ich, Jahren, Agentur Mary Poppins, Mein Kind, Vielen Dank, Frau Ritter, Herrn Ackermann, Babysitterin München Home, Agentur Mary Poppins Schweiz Agentur, Poppins Österreich Agentur Mary, Erlebnis, Cookies, Wenn Sie, Website, Wenn Sie, Zugang, Zweck, Nutzer, Zweck, Nachricht, Vorlieben Vorlieben Die, Zugriff, Zweck, Speicherung, Benutzer, Statistiken Statistiken Die, Zugriff, Zwecken, Zugriff, Zwecken, Ohne, Vorladung, Aufzeichnungen, Zweck, Die, Zugriff, Werbung, Website, Verwalten, Zwecke Akzeptieren Ablehnen Einstellungen"
"Diebabysitterei","https://diebabysitterei.de/","babysitter","12345678910111213141516","","","Babysitter, Nanny, Babysitterei Über, München Babysitter, Nanny Agentur Ihre, Nanny AgenturIhre, Kinderbetreuung, Familien, Egal, Babysitterin, Stunden, Woche, Nanny, Familie, Wir, Babysitterei, Aufgabe, Sie, Eine Babysitterin, Nanny, Ihnen, Ihren Wünschen, Ihrer Familie, Und, Bestes, Persönliche Qualität, Vermittlung, Gegründet, Mama, Familien, Ihre Wünsche, Babysitterei, Unser Erfolg, Gesprächen, Wir, Online Anfrageformular, Sie, Gespräch, Ihnen, Herzlich Willkommen, Babysitterei Hamburg München Vertrauen, Ich, Karin Hackstock, Babysitterin, Karin, Menschen, Babysitterin, Verständnis, Tamara N. Wir, Linda, Ihre, Kindern, Trainerin, Linda, Alex Lemb, Gründer, Vielen Dank, Nadja, Ich, Dich, Geschäftspartnerin, Weil Du Dich, Begeisterung, Immer, Dich, Dein Weitblick, Mutter, Dich, Ansprechpartnerin, Babysitterei Nürnberg, Steffanie Constantin Frau Hackstock, Wünsche, Babysitter, Danke, Matthias Weil, Suchen, Bedarf, Familie, Wir, Mama Sehr, Auswahl, Babysitterinnen, Familie Wallner Ich, Suche, Babysitter, Kleine, Terminen, Gelungene Auswahl, Auftreten, Kleine, Maria W. Liebe Frau Hackstock, Vielen, Dank, Griff, Gespür, Alexandra, Wir, Alles Gute, Ihre Agentur, Martina R. Tanja, Geschäftspartnerin, Ich, Jahren, Zuhörerin, Mutter, Familie, Tanja, Dank, Ich, Mit Deiner Herzenswärme, Erfahrung, Herausforderungen, Bleib, Liebe Karin, Vielen, Dank, Gespräch, Ich, Stelle, Elisabeth G. Als, Babysitter, Woche, Schule, Hausaufgaben, Viele Babysitterinnen, Karin, Wenn, Hause, Vielen Dank, Sandra Die Babysitterei, Babysittersuche, Christine T. Liebe Frau Hackstock, Dank, Gespräch, Ihnen, Mir, Stein, Herzen, Ihnen, Babysitter, Frau Hackstock, Frau, Hilfe, Mamis, Die Babysitterei, Kompetenz, Ich, Alles Gute, Grüße, Karin E. So, Babysitterin, Danke, Team, Familie Meier Wir, Linda, Taffen Tigern, Ganze, Liebe, Meine Tochter, Linda, Babysitterin, Frau, Arbeit, Meine Kleine, Linda, Madlen, Mutter, Kindern Den, Babysitter, Aufgabe, Babysitter, Schließlich, Betreuungsperson, Zum Blogartikel Die Babysitterei Deutschland, Hamburg, Unvergessliche Momente, Kinder, Babysitterei Österreich, Babysitterei FacebookInstagramImpressum Datenschutz"
"Nanny","https://nanny.vision/de/nanny-agenturen","babysitter","","","","Nanny Agenturen, Stellenangebote, Kinderbetreuung Suchen Start Stellen Berufe Bildung Agenturen Info Nanny Agenturen Deutschland, Sammlung, Nanny Agenturen, Schauen Sie, Kontakt, Alle Agenturen, Nanny, Tat, Nanny Agentur Renommierte Nannyagentur, Vermittlung, Nannys, Maternity Nurses, Anbieter Kids Concept Nannyagentur, Vermittlung, Maternity Nurses, Schweiz Mehr, Anbieter Starfamily Personaldienstleistungsagentur, München, Angeboten, Neben Nannys, Babysitter, Mehr Information, Anbieter Felicity Nannies Nannyagentur, München, Nannys, Anbieter Hauptstadtkinder Nannyagentur, Vermittlung, Maternity Nurses, Weiterbildung, Anbieter Rockmybaby Nannyagentur Netzwerk, Schweiz, Maternity Nurses, Anbieter Nanny Jobangebote Bilder, Nanny, Familien, München, Nannyagentur N4YK Agentur, Maternity Nurses, Die Betreuungszeiten, Angeboten, Agentur München, Familien, München, Nannyagentur Starfamily, Kinderfrauen, Maternity Nanny, Familienmanagerin, Weitere Angebote, Star Family Job Übersichtsseite, Agentur Berlin, Die Agentur Hauptstadtkinder, Grunewald, Prenzlauer Berg, Potsdam, Es, Vollzeitstellen, Nannies, Agentur Schweiz, Die Nanny Agentur, Zürich, Chancen, Nannys, Schweiz, Chur, Nehmen Sie Kontakt, Team, Nanny, Stellenangebote, Schweiz, Agentur Berlin, Vollzeit Nanny, Nannies, Klienten, Berliner Raum, Es, Vollzeit Positionen, Familien, Es, Stellen, Agentur Düsseldorf, Babysitter, Die Agentur, Meerbusch, Nannies, Babysitter, Vollzeitstellen, Die Region, Vermittlungsagentur, Babysitterangebote, Zum Angebot, Nanny, Nannies, Düsseldorfer Raum, Es, Vollzeit Positionen, Wir, Familien, Es, Stellen, Zum Angebot, Vollzeit Nanny, Nannies, Frankfurter Raum, Es, Vollzeit Positionen, Wir, Familien, Es, Stellen, Zum Angebot, Vollzeit Nanny, Nannies, Klienten, Hamburger Raum, Es, Vollzeit Positionen, Gesucht, Familien, Es, Stellen, Zum Angebot, Runde, Das Treffen, Termine, Jahr, Runde, Das Treffen, Zimmes, Termine, Jahr, Nanny Tagesanzeiger Zürich, Die Nannys, Die Nachfrage, Nanny, Bericht, Umgebung, Der Artikel, Martina Läubli, Onlinebereich, Zürich, Schweiz, Das College, Supernannys Die Liste, Nanny Schule, Von Prince Charles, Mick Jagger, Araber, Oligarchen, Kinder, Mehr Informationen, Feuilleton, Die Angst, Freiheit Interessanter Artikel, Beaufsichtigung, Hang, Vorort, Nanny Interessanter Artikel, Aussage, Cliff Greenhouse, Viele Kunden, Sorgen, Kinder, Nanny Pläne, Nanny, Pläne, Nanny Voraussetzungen Nanny, Nanny Verdienst Nanny Festanstellung Nanny Bewerbung Nanny Vermittlung Berufsbilder, Nanny Familienmanagerin Maternity Nanny Night Nanny Junior Nanny Nanny PA Governess Bildungsangebote München, Switch, Seminar, Nannys, Nanny Kurse, Ausbildung Tutzing, Nannys Australien, Miss Pepper Nanny School Jobs, Agenturen Nanny Agenturen, Nannyagenturen Datenschutz Impressum"
"Babysits","https://www.babysits.de/agentur/","babysitter","","","","Babysits Babysits Starte, Suche Babysitter Babysitter Jobs Schnell, Babysitter, Babysitter Job, Nähe, Einloggen Registrieren Konto Trete Babysits, Anmelden, Registrieren Die App, Unterstützung Tipps, Artikel So, Vertrauen, Sicherheit Hilfe, Referenzen Mehr, Nähe, Bist, Suche, Kinderbetreuungsagentur, Finde, Kinder, Melde, Pepler Agentur, Ich Heiße Emil Pepler, Umgang, Stunden, Brüder, Kinder, Kinder, Kleinkind, Wochen BUTLER, Suche, Nanny, Nähe, Dann, Sie, Kinder, Kinder, Letzte Aktivität, Kinder, Kinder, Ich, Schule, Geld, Kinder, Kinder, Letzte Aktivität, Monaten Wird, Karte, Babysits Agentur, Kinderbetreuung Wird, Mehr Filter Sortieren Relevanz Relevanz Letzte Aktivität Mitglied, Verifizierungen Hat Bewertungen, Finde, Kinderbetreuungsagentur Kinderbetreuungseinrichtung, Kinderbetreuungsagentur, Suche Filter, Kontakt Sende Nachrichten, Sicher, Kontakt Sende Nachrichten, Babysittertermin, Ausgaben, Melde, App Store Google Play Babysits, Millionen Mitglieder, Babysitter, Alltag, Vätern, Hause Hilfe, Nerina Diese Anwendung, Gefühl, Giovanna Es, Jahr, Arbeit, Ana Die Anwendung, Sehr, Amanda Es, Lebensunterhalt, Erfahrung, Kindern, Stefany Melde, Berlin Hamburg München Köln Frankfurt, Main Stuttgart Düsseldorf Essen Dortmund Dresden Bremen Nürnberg Hannover Leipzig Duisburg Bochum Wuppertal Bielefeld Bonn Mannheim Karlsruhe Wiesbaden Münster Gelsenkirchen Aachen Mönchengladbach Augsburg Chemnitz Kiel Braunschweig Krefeld Halle, Magdeburg Oberhausen Mainz Freiburg, Breisgau Erfurt Lübeck Hagen Rostock Karte Liste, Babysits Anmelden, Registrieren, Haken, Mensch, Einloggen Passwort, Vorname Nachname Stell, Ausweis, Updates, Konto, Passwort Setze, Haken, Mensch, Erlebnis, Leistung, Website, Wir, Verwendung, Sammeln, Mehr, Argentina Australia Austria Belgium Belize Bolivia Brazil Bulgaria Canada Chile Colombia Costa Rica Croatia Cyprus Czechia Denmark Dominican Republic Ecuador El Salvador Estonia Ethiopia Finland France French Guiana Germany Ghana Greece Greenland Guatemala Guyana Honduras Hong Kong SAR China Hungary Iceland India Indonesia Ireland Israel Italy Jamaica Japan Kenya Latvia Liechtenstein Lithuania Luxembourg Malaysia Malta Mauritius Mexico Moldova Morocco Netherlands New Zealand Nicaragua Nigeria Norway Panama Paraguay Peru Philippines Poland Portugal Puerto Rico Qatar Romania Saudi Arabia Serbia Singapore Slovakia Slovenia South Africa South Korea Spain Sri Lanka Suriname Sweden Switzerland Taiwan Tanzania Trinidad, Tobago Türkiye Uganda Ukraine United, Arab Emirates United Kingdom United, States Uruguay Venezuela Vietnam German English German Babysits So, Hilfe Bedingungen, Datenschutz Preise Impressum Babysits, Berufstätige Babysits Shop Entdecke, Artikel Vertrauen, Sicherheit Community Leitfaden Partner Babysits, Bedürfnisse Beliebt Babysitter Berlin Babysitter Hamburg Babysitter München Babysitter Köln Babysitter Frankfurt, Main Babysitter Jobs Folge, Babysits"
"Mainbabysitter","https://mainbabysitter.com/kontakt/","babysitter","004917630598282, +4917630598282","info@mainbabysitter.com","","Kontakt, Babysitter Zum Inhalt, Main Babysitter Der, Babysitter Service, Frankfurt Menü English Home Leistungen Ihre Vorteile, Partner Kontakt Main Babysitter Frankfurt, Umgebung Für Babysitter Mehr Kontakt Sie, Babysitter, Ihr Kind, Dann, Sie, Wir, Ihnen, Telefon Adresse, Betreuung Präferierte Sprachkenntnisse Wie, Sie, Nachricht Senden, Impressum Datenschutz Impressum Main Babysitter Frankfurt, Umgebung Frankfurt, Main, Erstelle, Blog, Babysitter Anpassen Registrieren Anmelden Kurzlink, Inhalt Abonnements, Diese Website, Wenn, Verwendung, Weitere Informationen, Kontrolle"
"Diebabysitterei","https://diebabysitterei.at/wien/","babysitter","123456789101112131415161, 71819202122","","","Babysitter, Nanny Agentur, Die Babysitterei, Kurse Für Familien Babysitter, Nanny, Babysitter, Nanny, Babysitter, Nannys Rezensionen Unser Kinderclub Babysitter, Nanny Babysitter Jobportal Nanny Jobportal Als Babysitter, Als Nanny, Hotel Nanny Deutsch English Service Kontakt Blog, Babysitter Unser Anspruch Menü Menü Liebevoll, Babysitter, Nannysfür, Babysitter, Nannysfür, Kennen Sie, Stunden, Freunden, Wunsch, Hobby, Die Omas, Beginn, Nanny, Eine, Babysitterin, Nanny, Flexibel, Herz, Kinder, Sturm, Klingt, Bekanntenkreis, Jeder, Eine Flut, Nanny, Vorweg, Online, Wohl, Kinder, Babysitter, Stunden, Nanny, Kinder, Persönliche Qualität, Vermittlung, Ihre Wünsche, Persönliche Gespräche, Als Gründerin, Babysitterei, Familie, Babysitterinnen, Nannys, Zuhören, Sie, Ihnen, Aus, Erfahrung, Mama, Mum, Babysitterin, Nanny, Daher, Gespräch, Ihnen, Ihr Vertrauen, Ihnen, Ihre Karin Hackstock, Babysitterei Kostenloses Beratungsgespräch, Wofür, Babysitterei Wien, Flexibel Für, Ihre Wünsche, Ihrer Babysitterin, Verpflichtungen Faire Stunden Löhne, Agentur Aufschläge Keine Mitgliedschaft, Bindung Persönlich, Qualifiziert Unsere, Team Babysitterinnen, Bewerbungsverfahren, Expert, Hilfe Kurs, Zuverlässig Weil, Ihnen Premium Sorglos Pakete, Babysitter, Wechsel Mehr, Beratungsgespräch, Erfahrungen, Filterung, Bewerbung, Suchen, Herzlichen Dank, Klärung, Ziele, Macht, Stephanie Ch, Die Babysitterei, Babysittervermittlung, Die Betreuung, Familie, Babysitter, Lili M. Wirklich, Agentur, Kinderbetreuung, Auch, Buchungen, Wir, Julia Sehr, Hat, Babysitterin, Rotraud Lang Sehr, Telefonat, Ich, Babysitter, Nadine K. Ich, Karin, Vielen Dank, Gespräch, Infos, Sabrina H. Ausgezeichnet, Besser, Vielen, Dank Lena S. Sehr, Frau Hackstock, Fragen, Nanny, Sophie G. Die Beratung, Babysitterei Erfahrung, Marco N. Jeden Penny, Jeanne Chales, Jakob F. Wir, Agentur, Für, Nach, Anfrage, Anruf, Babysitterei, Wiederum, Zeit, Babysitter, Wir, Wahl, Wir, Babysitterin, Erfahrung, Weile, Unsere, Und, Suche, Ich, Suche, Familie, Wien Sehr, Nachdem, Eindrucks, Babysitterei, Schon, Die Inhaberin, Beratungsgespräch, Keine Abos, Und, Frau Hackstock, Eratzbabysitterin, Herzlichen Dank, Helmut Die Babysitterei, Familie, Hilfe, Herz, Ich, Babysitterin, Babysitterei SUPER, Von Frau Hackstock, Fragen, Ich, Anabel Schneider Wir, Frau Hackstock, Nach, Gespräch, Handvoll, Babysitterinnen, Die Vorauswahl, Kennenlernphase, Babysitterin, Danke, Gabriel H. Sehr, Babysitter Agentur, Wir, Gespräch, Agentur Chefin, Innerhalb, Babysitter Vorschläge, Nach, Bewerberin, Während, Fragen, Wir, Alexander F. Ich, Babysitterei, Herr, Frau Hackstock, Die Agentur, Match, Wirklich, Steffi B. Wir, Suche, Babysitterin, Eine Babysitterin, Vielen Dank, Maria K. Hier, Von Notfalls Babysitter, Sehr, Susi Die Babysitterei, Babysitteragentur, Doris Very, Felisha Unser, Kinderclub, Pinsel, Zum Kinderclub Den, Babysitter, Aufgabe, Babysitter, Schließlich, Betreuungsperson, Zum Blogartikel Die Babysitterei Deutschland, Hamburg, Unvergessliche Momente, Kinder, Babysitterei Österreich, Babysitterei FacebookInstagramImpressum, Babysitter AGB Nannys Datenschutz, Classic, Unsere, Klassikerin Persönliches Beratungsgespräch, Erstellung Ihrer, Kennenlernen, Inklusive HR Unterlagen, Kennenlernen, Zugang, Überblick, Strafregisterauszug Wir, Sie, Vorauswahl, Babysitterinnen Keine, Den Stundenlohn, Babysitterin, Wir, Ihnen, Tat, Ihre Babysitterin Bonus, Wert, Kein Problem, Ihrer Seite, Nachbesetzung Auf Wunsch, Termin Vereinbarung, Kennenlernen, Termine, Ihrer WunschkandidatIn Im Falle, Sollten Sie, Babysitterin, Kosten, Einmalige Gebühr, Familien, Classic Deluxe Package, Dieser Service, Zugang, Unser Premium Notfallbabysitter Service, Falle, Krankheit, Individuelle Vorauswahl, Ihre Familie, Babysitterin, Lfzt, Sorglos Package, Classic Deluxe Packages, Babysitterin Persönliches Beratungsgespräch, Erstellung Ihrer, Keine, Den Stundenlohn, Babysitterin, Wir, Ihnen, Tat, Ihre BabysitterIn Exklusiver Zugang, Überblick, Strafregisterauszug Bonus, Weil, Ausfalls Ihrer Babysitterin, Nachbesetzung Wir, Sie, Vorauswahl, Alle Leistungen, Wert, Bewerberinnen Im Falle, Beratungsgespräch, Kosten, Kennenlernen, Termine, Lfzt, Classic, Unsere, Klassikerin Persönliches Beratungsgespräch, Erstellung Ihrer, Kennenlernen, Inklusive HR Unterlagen, Kennenlernen, Zugang, Überblick, Strafregisterauszug Wir, Sie, Vorauswahl, Babysitterinnen Keine, Den Stundenlohn, Babysitterin, Wir, Ihnen, Tat, Ihre Babysitterin Bonus, Wert, Kein Problem, Ihrer Seite, Nachbesetzung Auf Wunsch, Termin Vereinbarung, Kennenlernen, Termine, Ihrer WunschkandidatIn Im Falle, Sollten Sie, Babysitterin, Kosten, Einmalige Gebühr, Familien, Classic Deluxe Package, Dieser Service, Zugang, Unser Premium Notfallbabysitter Service, Falle, Krankheit, Individuelle Vorauswahl, Ihre Familie, Babysitterin, Lfzt, Sorglos Package, Classic Deluxe Packages, Babysitterin Persönliches Beratungsgespräch, Erstellung Ihrer, Keine, Den Stundenlohn, Babysitterin, Wir, Ihnen, Tat, Ihre BabysitterIn Exklusiver Zugang, Überblick, Strafregisterauszug Bonus, Weil, Ausfalls Ihrer Babysitterin, Nachbesetzung Wir, Sie, Vorauswahl, Alle Leistungen, Wert, Bewerberinnen Im Falle, Beratungsgespräch, Kosten, Kennenlernen, Termine, Lfzt"
"Hallobabysitter","https://www.hallobabysitter.de/kinderbetreuung/babysitter","babysitter","","","","Babysitter, Hallo Babysitter Blog Hilfe Für Unternehmen, Babysitter Jobs Login Registrieren Babysitter, Babysitter Jobs Login Registrieren Blog Hilfe Für Unternehmen, Suche Stadt, Postleitzahl Umkreis, Jetzt Betreuer, Jan, Wildau Jan, Erfahrung, Mathilda, Mathilda, Erfahrung, Stella, Stella, Erfahrung, Angela, Angela, Erfahrung, Milena, Milena, Jahre Erfahrung, Lara, Jahre Erfahrung, Erfahrung, Paula, Paula, Erfahrung, Berlin Jennifer, Erfahrung, Pauline, Pauline, Erfahrung, Marcelina, Marcelina, Erfahrung, Erfahrung, Rostock Jill, Erfahrung, Erfahrung, Leonie, Leonie, Erfahrung, Sandra, Sandra, Erfahrung, Leoni, Leoni, Erfahrung, Jasmin, Jasmin, Erfahrung, Noemi, Noemi, Erfahrung, Petra, Petra, Erfahrung, Zertifikaten Aktuelle Inserate, Qualität Keine Kosten, Kontaktaufnahme Babysitter, Wir, Wir, Babysitter, Umgebung, Und Kinderbetreuer, Babysitten, Nebenjob, Tagesvater, Geben Sie, Ihren Wohnort, Ihren, Dabei, Sie, Babysitter, Babysitter, Notfallbetreuung, Impressum AGB, Kontakt Für Unternehmen, Partnerprogramm DE EN, Familie GmbH, Babysitter Babysitter Berlin Babysitter Bonn Babysitter Düsseldorf Babysitter Frankfurt Babysitter Hamburg Babysitter Hannover Babysitter Karlsruhe Babysitter Köln Babysitter Leipzig Babysitter München Babysitter Nürnberg Babysitter Stuttgart, Städte Tagesmutter Tagesmutter Berlin Tagesmutter Frankfurt Tagesmutter Hamburg Tagesmutter Hannover Tagesmutter Köln Tagesmutter München Babysitter Babysitter Jobs Berlin Babysitter Jobs Frankfurt Babysitter Jobs Hamburg Babysitter Jobs Köln Babysitter Jobs München, Eltern Für Babysitter Kindertagespflege Kindersicherer Haushalt Erste Hilfe Babysitterkurse Babysitter, Eltern FAQ, Babysitter Unser Service Service Garantie"
"Erstekinderbetreuung","https://www.erstekinderbetreuung.de/babysitter-berlin","babysitter","0-2
3-5
6-11, 12-16
16, 2012-2024","","","Hilfe, Kinderbetreuung Das, Kinderbetreuung Start Kinderbetreuung Betreuungsangebote Betreuungsgesuche Magazin, Kinderbetreuung Aufträge, Kinderbetreuung PLZ Umkreis Umkreis, Finden Detailsuche Öffnen Schließen Was Kinderbetreuung Aufträge, Ort Suche, Babysitter Tagesmutter, Nanny, Leihoma, Weiblich Männlich, Zuletzt, Zeiten, Alles, Alle, Suche, Suche, Info Kinderbetreuung Babysitter Tagesmutter Nanny Betreuungsangebote Betreuungsgesuche Dringende Kinderbetreuungsgesuche Magazin Babysitter, Berlin Ishika, Kontakte Von, Kontakt, Babysitter Betreut, Alter, Jahre Sprachen, Hallo, Mein Name, Ishika, Jahren, Babysitterin, Details Nachricht Telefon Details, Agnes38 Kontakte, Kontakt, Babysitter, Tagesmutter, Nanny, Leihoma Betreut, Stunde, Deutsch, Englisch, Ágnes S., Details Nachricht Telefon Details, Berlin Tess, Kontakt, Ausbildung, Erfahrung Babysitter, Tagesmutter, Nanny, Leihoma Betreut, Kinder, Alter, Stunde, Hilfe, Woche, Wochenende, Gerne, Mona, Details Nachricht Details, Berlin Daliah, Daliah Verifiziertes Mitglied Die Identität, Mitglieds, Zertifikat, Identität, Kopie, Verifiziert Kontakte, Kontakt, Tagesmutter Betreut, Alter, Stunde, Französisch Nach, Abitur, Zeitraum, Studiums, Ausb, Details Nachricht Telefon Details, Berlin Liz, Kontakte Von, Kontakt, Babysitter Betreut, Jahre, Stunde, Schwedisch Hey, Ich, Liz, Nebenbei, Babysitter Job, Woche, Besten, Details Nachricht Telefon Details, Berlin Daniela, Kontakte Von, Kontakt, Kinderbetreuung Babysitter, Tagesmutter, Nanny Betreut, Kinder, Stunde, Englisch Liebe Eltern, Daniela, Außerdem, Details Nachricht Details, Berlin Maya Sofia, Kontakt, Babysitter, Nanny Betreut, Alter, Stunde, Deutsch, Englisch Ich, Details Nachricht Telefon Details, Ftraina Verifiziertes Mitglied Die Identität, Mitglieds, Zertifikat, Identität, Kopie, Verifiziert Kontakte, Kontakt, Betreuung Ihrer Kleinen, Tagesmutter, Nanny, Leihoma Betreut, Alter, Stunde, Deutsch, Details Nachricht Telefon Details, Berlin Irina, Irina373 Verifiziertes Mitglied Die Identität, Mitglieds, Zertifikat, Identität, Kopie, Verifiziert Bewertungen Bitte, Kontakt, Kindern Babysitter, Nanny Betreut, Alter, Stunde, Ukrainisch Ich, Kind, Das Kind, Ich, Details Nachricht Details, Berlin Kasandra, Kasandra Bewertungen Bitte, Kontakt, Nanny Betreut, Kinder, Alter, Stunde, Englisch Hallo, Ich, Hause, Büro, Habe, Betreuung, Details Nachricht Details, Berlin Liana, Liana1998 Kontakte, Kontakt, Tagesmutter, Nanny, Leihoma Betreut, Kinder, Alter, Stunde, Deutsch, Englisch Ich, Familie, Erfahrung, Umgang, Ich, Montags, Details Nachricht Details, Berlin Annabel, Felicia33 Kontakte, Kontakt, Kinderbetreuung, Babysitter, Tagesmutter, Nanny, Leihoma Betreut, Stunde, Liebe Eltern, Ich, Ich, Pädagogik, Ich, Details Nachricht Details, Berlin Lothar, Lothar Verifiziertes Mitglied Die Identität, Mitglieds, Zertifikat, Identität, Kopie, Verifiziert Bewertungen Bitte, Kontakt, Bringen, Nanny, Leihopa Betreut, Stunde, Ich, Lothar, Neuausrichtung, Bereich, Dabei, Details Nachricht Telefon Telefon Details, Berlin Helen Suna, Kontakt, Babysitter Betreut, Alter, Stunde, Englisch Hallo, Familie, Mein Name, Helen Suna, Jahre Erfahrung, Die Kinder, Details Nachricht Telefon Details, Berlin Sabine, Sabine81 Kontakte, Kontakt, Babysitter Betreut, Kinder, Alter, Stunde, Portugiesisch Gerne, Ihre Kinder, Wochenende, Nach Absprache, Details Nachricht Telefon Details, Berlin Stefanie, Stefanie B Kontakte, Kontakt, Nanny Betreut, Alter, Stunde, Englisch Liebe Familie, Stefanie, Nanny, Details Nachricht Telefon Details, Berlin Thais, Mitglieds, Zertifikat, Identität, Kopie, Verifiziert Kontakte, Kontakt, Babysitter, Tagesmutter, Nanny Betreut, Stunde, Deutsch Hallo, Jahren, Babysitterin, Montag, Freitag, Ich, Details Nachricht Telefon Details, Berlin Luciana, Kontakte Von, Kontakt, Wochentage, Nanny Betreut, Stunde, Mein Name, Ich, Suche, Familie, Hilfe, Montag, Details Nachricht Telefon Details, Berlin Silje, Silje Kontakte, Kontakt, Musikfähigkeiten Babysitter, Tagesmutter, Nanny, Leihoma Betreut, Alter, Stunde, Deutsch, Schwedisch Hallo, Silje, Ich, Künstlerin, Ich, Details Nachricht Details, Berlin Weneta, Weneta Kontakte, Kontakt, Tagesmutter, Nanny, Leihoma Betreut, Alter, Stunde, Details Nachricht Telefon Details, Hamburg Babysitter, Bochum, Impressum AGB Datenschutz Firmenlizenz Magazin Kontakt Abo, Hilfe Cookies"
"Kimeta","https://www.kimeta.de/stellenangebote-babysitter","babysitter","2024 12","","","Stellenangebote, Babysitter, Dich, Konto, Deine Favoriten, Suchen, Konto, Corona JobsSystemrelevante, Babysitter, Stellenangebote Babysitter Jobs, Poppins, Die Eltern, Kinder, Sie, Kiga, Ihnen, Bringen Sie, Alltag, Zeige, Stellenangebote KinderFinde, Babysitter, Ersten Finde, Babysitter Job Du, Dann, Babysitter Job, Hamburg, Woche Was, Beim Babysitten, Bereich, Kinderbetreuung, Kinder, Alle Jobs, Stellenangebote, Woche, Aktuell, Mädels, Schule, Hause, Turnverein, Reiten, Wichtig, Alle Jobs, Stellenangebote KindermädchenNebenjob Babysitter, Woche Zwischen, Stunde Was, Liebe Babysitterin, Nanny, Wir, Babysitterei, Agentur, Babysitter, Nanny Vermittlung, Unsere Leidenschaft, Familie, Alle Jobs, Stellenangebote NebenjobBUK Familienbewusstes, Die Betreuung, Woche, Absprache, Alle Jobs, Gefühl, Menschen, Oder, Dann, Bereichen, Zeige, Stellenangebote NebenjobWeitere Jobs, Babysitter, Aktuell, Jobs ReferentJobs, Jobs City, Babysitter, Wikipedia Information, Jobs NannyImpressumAGBCookie"
"Aboutyou","https://www.aboutyou.de/impressum","babysitter","30 15 085, 126781, 339819462, 171601","","","High HeelsHalbschuheStiefelettenPantolettenBallerinasSportschuheStiefelBadeschuheHausschuheSchuhzubehörHighlightsNeuTrendingNachhaltigkeitExklusivTop, Ralph LaurenLauren Ralph, Ralph LaurenHALLHUBERTop, Lena GerckeGuido Maria Kretschmer, Lorena Raeflorence, Slouchy, Maria Kretschmer, Dein, Unsere SneakerHall, Rückversand100 Tage, Rechnung Impressum, Dir, Kontaktform Kontakt Email, Oder, Paket, Impressum Verantwortlich, Seite, Bitte, Amtsgericht Hamburg, Amtsgericht Hamburg, Sebastian Betz, Tarek Müller, Hannes Wiese Vorsitzender, Sebastian Klauke, Bildquellen, Sina Görtz, Patrick Houi, Albiedo, Yaisumlee, Ortis, Inawa, Faelchle, Matthew Jean-Louis, Lars Johansson, A_Lein, Mytho, Michael Jung, Tanya Lipskaya, Vladimir Sazonov, Mikhail, Ottoson, Photobac, Mikhail, Artur, Kiuikson, Möglichkeit, Diese Plattform, Link, Verfahren, Kostenloser Versand, Rückversand100 Tage, Jeans DamenBrax, Lena GerckeKundenserviceHilfe, Deine Daten, Netzen, Bei Anrufen, Gebühren"
