"Company Name","Url Link","Keyword Selected","Phone","Email","Address","Person Name"
"Reutersagency","https://www.reutersagency.com/de/about/contact-support/","babysitter","","","","Brasilien Russisch Spanisch Anmelden Eine Demo, Rundfunkanstalten Verlag Regierungen Profis Sportmedien, Pharma Maschinelles Lernen, Lifestyle Menschliches Interesse Gesundheit Umgebung Alle Themen Reuters Community Dienstleistungen Dienstleistungen Reuters Content Studio Werbelösungen Verifizierungsdienste, Images Medienlösungen Nutzergenerierte Inhalte Reuters Ready Bereit, Archiv Plattformen Reuters Connect, Pictures Platform, Feeds, Werte Partner Kontaktieren Sie, Beantragen Sie, Sie Zugang, Millionen, Bildern, Journalisten, Bericht, Ihre Fragen, Contact Editorial Kundensupport Sie, Kunde, Frage, Frage, Ihrer Rechnung, Thomson Reuters, Branchen, Allgemeine Anfragen Wenn Sie, Sie, Vorname, Adresse, Telefon, Please Select, Saint Eustatius, People, San MarinoSao Tome, Jan Mayen IslandsSwazilandSwedenSwitzerlandSyrian, Arab, Caicos, Arab, Virgin Islands, Wallis, Futuna, Branche, Please Select, Public ServicesIndustrial Goods, Please Select, Networks News Agency, Audio Woran, Sie, Dienstleistungen, Indem Sie Ihre Daten, Sie, Indem Sie Ihre Daten, Sie, Dienstleistungen, Indem Sie Ihre Daten, Sie, Indem Sie Ihre Daten, Sie, Dienstleistungen, Indem Sie Ihre Daten, Sie, Richtlinie, Lieferkette Follow, Facebook Twitter LinkedIn, Thomson Reuters, Die Cookies, Öffnen, Website, Ihrem Computer, Bei Bedarf, Sie Ihre, Browser, Verwendung"
"Duolingo","https://www.duolingo.com/contact","babysitter","","","",""
"Nebenjob","https://www.nebenjob.de/ratgeber/2450-nebenjob-als-babysitter-so-konnen-sie-mit-babysitting-geld-verdienen","babysitter","14-08-2019","","","Babysitter, Stellenanzeige, Stellenanzeige, Einloggen Unternehmen Registrieren Einloggen Registrieren, Stellenangebote Gesamte Website, Babysitter, Sie, Nebenjob Mittwoch, Menschen, Schülern, Studenten, Babysitter, Geld, Egal, Kinder, Stichwort Date Night, Doch, Wenn, Arbeit, Babysitter, Richtige, Babysitter, Eltern, Wenn, Finger, Doch, Voraussetzungen, Babysitter, Dieser Nebenjob, Menge Geduld, Kinder, Welche Aufgaben, Ende, Kinder, Berufsbezeichnung, Kinder, Mache, Hexenwerk, Ein, Vertrauen, Als Schüler, Schule, Schulen, Menge Verantwortung, Menge, Dinge, Spiele, Vorbeugung, Wenn, Schüler, Schule, Kurse, Auch, Rote Kreuz, Kinderschutzbund, Die Chemie, Babysitter, Faktoren, Erfahrung, Chemie, Ebene, Klar, Gefühl, Kids, Funke, Chemie, Babysitter, Bevor, Sprich, Wenn, Babysitter, Einsatz, Eltern, Dinge, Kind, Kläre, Vorhinein, Fernsehen, Tür, Regeln, Essen, Wenn, Zum Anderen, Kinder, Nebenjob Babysitter, Wie, Babysitter, Denn, Bezahlung, Rolle, Erfahrung, Doch, Anzahl, Kinder, Rolle, Sollst, Zudem, Bezahlung, Raum, Babysitter, Wichtig, Verdienst, Dienste, Babysitter, Babysitter, Wege, Klassisch, Aushang, Schulen, Wenn, Geschäft, Kundschaft, Eltern, Wege, Wege, Babysitter, Denn, Dazu, Babysittern, Leihomas, Artikel Beliebte Beiträge Schritt, Sie, Der Wunsch, Traum, Endlich, Chef, Warum Fernstudium, Abi, Social Media, Ein Leitfaden, Social Media, Ein Leitfaden, Einen Karrierestart, Radiobereich, Wenn, Dann, Registrieren Kategorien, Beruf, Beliebt Warum, Nebenjob, Lebenslauf, Von Teilzeit, Vollzeit, Nebenjob Über Nebenjob Arbeiten, Anzeige, Alle Jobs, Minijob, Bewerbungstipps NebenJob, Website Social, Tochtergesellschaft, Alle Rechte, Login, Unternehmen Angemeldet, Login Kostenloses Unternehmensprofil Wenn Sie, Sie, Schritte, Mitarbeiter, Noch, Unternehmensprofil"
"Wondershare","https://www.wondershare.de/about/contact-us.html","babysitter","245-3674, 245-3674, 808-1885, +44 808 169 7181, 326-5975","","","Kontakt, Filmora Intuitive Videobearbeitung, Anireel Animierte, Filmstock Videoeffekte, Musik, Alle Produkte, Entdecken Übersicht Video Foto, Grafiken Diagramme, Mockitt Schnelle Layouterstellung, Alle Produkte, Entdecken Übersicht UI, Document Cloud, Alle Produkte, Entdecken Übersicht, Dateien, Repairit, Alle Produkte, Entdecken Übersicht, Soziale Medien Ressourcen KI Tools KI Newsroom Business Shop Support Anmelden, Globale Präsenz Karriere Kontakt Kontaktieren Sie, Gehen Sie, Unternehmen Geschäftliche Anfragen Klicken Sie, Wiederverkäufer Partner Um, Wiederverkauf Partner, Sie, Ihre Fragen, Sie Mitglied, Füllen Sie, Medien Für Medienanfragen, Füllen Sie, Absenden KONTAKTIEREN, Shareasale Awin Admitad Ich, Kanal, Filmora, Tag Internationale Telefontarife, Ihrem Dienstanbieter, Hero Produkte Filmora, Kontakt Video Community, Unsere AGB Datenschutzerklärung Impressum Verwendung, Rückerstattung Deinstallieren Copyright, Alle Rechte, Der Bestellvorgang, Steuererstellung, Wondershare Technology Group, Sprache English Arabic, Deutsch Spanish, Español Russian, Pусский Japanese, Bahasa Indonesia"
"Trustpilot","https://de.trustpilot.com/review/hallobabysitter.de","babysitter","","","","Bewertungen, Lesen Sie Kundenbewertungen, Sterne0, Sterne9, Stern55, Felder2 BewertungenAT10, Anfrage, Kündigung, Erfahrung, Hoffnung, Kunde, Masche, Zeiträume, Mal, Kündigung, Abo, Eindeutig Masche, Wirklich, Dass, Leute, Man, Babysitter, Nur, Datum, Erfahrung, Jibat3 BewertungenDE2, Nov, Eigentlich, Sterne, Man, Person, Veraltete Konten, Absoluter Müll, Frechheit, Abo, Für, Erfahrung, Ich, Diesen, Personen, Nach, Antwort, Anzeige, Sonst, Antworten, Der Verdacht, Sehr, Erfahrung, Suche, Babysitter, Plattform, Ich, Lediglich, Person, Account, Anzeige, Babysitterin, Wir, Mitgliedschaft, Datum, Erfahrung, Babysitter SeiteDas Modell, Der Aufbau, Seite, Bezahlung, Dann, Frage, Ich, Antworten, Die, Vorstellungen, Ich, Kind, Kind, Pure Ausnutzerei, Auch, Hilfsbereitschaft, Resultat Datum, Erfahrung, Dez, Ich, Die Seite, Erfahrung, Hugo1 BewertungDE29, Ich, Babysitter, Erfahrung, Adams1 BewertungDE6, Mitteilung, Erfahrung, Sprachen, Zurück1Nächste SeiteIst, Ihr Unternehmen, Zugang, Beziehung, Ihren Kunden, Account, Ihr Unternehmen, Zugang, Beziehung, Ihren Kunden, Account, Quellen, Bewerten, Der Verfasser, Bewertung, Einladungen, Diese Bewertungen, Hinweis, Sie, Arten, Erfahren Sie, Schreiben, Menschen, Richtlinien, Außerdem, Land, Ihres VertrauensHilfecenterEinloggenAnmeldenUnternehmenTrustpilot, Alle Rechte"
"Yoopies","https://yoopies.de/babysitters/hamburg","babysitter","","","","Jetzt Kontakt, Ich, Betreuer Babysitter Hamburg, Babysitter Profile Nach, Schule, Vollzeit, Hauswirtschaft Tierpflege Kinderbetreuung Dienstleistungen Kinderbetreuung Nachhilfeunterricht Altenpflege Hauswirtschaft Tierpflege Suche Welchen Service, Sie, Erfahrene Kinderbetreuung, Betreuung Ihrer Kleinen Stella Hamburg, Verifiziert Babysitting Hallo, Ich, Abitur, Anschluss, Ich, Basteln, Malen Hilfe, Christina Hamburg, Verifiziert Ich, Hamburg Hallo, Mama, Papa, Ich, Freizeit, Kinder, Wochenende, Basteln, Malen Montessori Micaela Hamburg, Verifiziert Former, Micaela, Montessori Basteln, Malen Monique Hamburg, Liebe Babysitterin, Hamburg Mein Name, Ausbildung, Zuvor, Ich, Ausflüge Basteln, Malen Maria Hamburg, Verifiziert Erfahrende, Babysitterin Mein Name, Maria, Ende Juni, Basteln, Malen Montessori Charlotte Hamburg, Biete, Ich, Charlotte, Klinische Psychologie, Master, Erfahrung, Ich, Ausflüge Basteln, Malen Nicole Hamburg, Empfohlen Erfahrene Betreuerin, Hallo Zusammen, Ich, Familien, Dabei, Kinderbetreuung, Da, Basteln, Malen Hilfe, Delia Hamburg, Empfohlen Erfahrene Babysitterin, Ich, Erzieherin, Studium, Ich, Basteln, Malen Ausflüge Shama Hamburg Neuer Benutzer Experience, Shama, Basteln, Malen Franka Hamburg, Babysitterin, Erfahrung Ich, Franka, München, Seit, Babysitten, Ich, Hilfe, Hausaufgaben Basteln, Malen Leonie Hamburg Neuer Benutzer Verifiziert Babysitterin, Familie, Kindern Hamburg Moin, Alsuna Leonie, Direkte Babysitting Erfahrung, Familie, Hilfe, Hausaufgaben Ausflüge Nicole Hamburg, Empfohlen Kinderbetreuung, Hamburg Mein Name, Nicole, Mutter, Ich, Die Arbeit, Basteln, Malen Hilfe, Désirée Hamburg, Sozialpädagogin Mein Name, Ich, Sozialpädagogikstudium, Jugendlichenpsychotherapeutin, Basteln, Malen Montessori Leonie Hamburg, Babysitterin, Familie Ich, Leonie, Dual Medien Management, Ich, Familie, Woche, Ich, Hilfe, Hausaufgaben Basteln, Malen Lea Hamburg, Empfohlen Liebevolle Studentin, Kind Hey, Ich, Leider, Cousins, Basteln, Malen Hilfe, Empfohlen Psychologiestudentin, Wochenend Ich, Semester Psychologie, Kind, Diabetes, Montessori Ausflüge Victor Hamburg, Verifiziert Erfahrener, Hamburg Mein Name, Victor, Mit, Umgang, Kindern, Erfahrung, Ausflüge Montessori Maria Hamburg, Babysitter, Hamburg Universitätsabschluss, Mit Erfahrung, Pflege, Weitere Profile, Babysitter, Nähe, Hamburg HamburgNorderstedtWedelWentorf, Pola, Alessio, Richard, Ezinne Jessica, Nikolina, Oleg, Manuel, Lorena, Eleonora, Anna, Mit Erfahrung, Babies, Ich, Danna, Madeleine B, Ihre Arbeit, Sohnes, Vielen, Dank, Menü, Menü Hilfe Ich, Babysitter Job Registrieren Einloggen Suchen Dienstleistungen Kinderbetreuung Altenpflege Reinigungskraft Nachhilfe Haustierbetreuung Finden, Hilfe, Deutsch Englisch, Services Kinderbetreuung Altenpflege Reinigungskraft Nachhilfe, Datenschutz Rechtliche Informationen Wenn Sie, Verwendung, Ihnen, Ihre Interessen, Mehr"
"Babysits","https://www.babysits.com/","babysitter","","","","Babysitting Jobs, Babysits Babysits Start, Account Join Babysits Log, Articles, Trust, Safety Help Pricing Search Favorites Log, Babysitter, Daniela Espino The Bronx Letecia Lauderhill, Brandon Zada Richmond Astrid Long Beach Brenda Clayton Brianna Lauderdale Lakes See, Babysits, Connect Send, Book Book, Beautiful, Highly, Stefany Sign, App Store Google Play Discover, Trust, Safety Tips, Work Climate, Babysits, Babysits, Imagine, Brooklyn Chicago Houston Borough, San Antonio San, San Francisco Seattle Denver Washington, Nashville El Paso Oklahoma City Detroit Boston Portland Memphis Las Vegas Milwaukee Baltimore Albuquerque Tucson Fresno Sacramento Omaha Kansas City Long Beach, Babysits, Okay Decline Argentina Australia Austria Belgium Belize Bolivia Brazil Bulgaria Canada Chile Colombia Costa Rica Croatia Cyprus Czechia Denmark Dominican Republic Ecuador El Salvador Estonia Ethiopia Finland France French Guiana Germany Ghana Greece Greenland Guatemala Guyana Honduras Hong Kong SAR China Hungary Iceland India Indonesia Ireland Israel Italy Jamaica Japan Kenya Latvia Liechtenstein Lithuania Luxembourg Malaysia Malta Mauritius Mexico Moldova Morocco Netherlands New Zealand Nicaragua Nigeria Norway Panama Paraguay Peru Philippines Poland Portugal Puerto Rico Qatar Romania Saudi Arabia Serbia Singapore Slovakia Slovenia South Africa South Korea Spain Sri Lanka Suriname Sweden Switzerland Taiwan Tanzania Trinidad, Tobago Türkiye Uganda Ukraine United, Arab Emirates United Kingdom United, States Uruguay Venezuela Vietnam Babysits, Privacy Pricing, Babysits, Work Babysits Shop Discover, Articles Trust, Safety Community, Babysits"
"Babysitterfrankfurt","https://www.babysitterfrankfurt.de/kontakt/","babysitter","","","","Kontakt, Babysitter Tipps, Suche, Babysitter, Kontakt Babysitter, Gerne, Betreff, Bitte, Text, Menü Babysitter, Babysitter, Erstes Mal Babysitten Babysitter, Aufgaben Babysitter, Mädchen Kontakt Durchsuchen Suche, Erstellen Sie"
"Nina","https://www.nina.care/de/babysitter/","babysitter","+31 85 4005252","info@nina.care","","Einen, Babysitter, Liebevoll, Für Eltern Au Pair Buchen Babysitter Buchen Informationen, Hilfe Für Babysitter Babysitter Werden Finden Sie, Familie Hilfe Für Au Pairs Au Pair Werden Familie, Hilfe Kontakt, Stellenangebote Blog Deutsch Dutch, Registrieren Anmeldung, Eltern Au Pair Buchen Babysitter Buchen Informationen, Hilfe Für Babysitter Babysitter Werden Finden Sie, Familie Hilfe Für Au Pairs Au Pair Werden Familie, Hilfe Kontakt, Stellenangebote Blog Home Buchen Sie, Babysitter Buchen Sie, Babysitter Flexibel, Flexible, Babysitter, Stellen Sie Ihre Anfrage, Mitgliedschaft Standard Monatlich, Prämie Monatlich, Stellen Sie, Eltern, Finden Sie, Person, Unser Ziel, Nanny, Wir, Jasmijn, Lyla Kok, Gründerinnen, Dank, Erfahrung, Unsere, Handumdrehen, Wir, Kurse, Akademie, Teil, Teams, Worauf, Machen Sie, Lernen Sie, Babysitter, Babysitter Au, Sorry, Wie, Laden Sie, Anwendung, Erstellen Sie, Stellen Sie, Anfrage Notfall, Ihre Anfrage, Ihnen, Sitter Kennenlernen, Ausgehen, Fragen, Eltern Was, Babysitter, Unsere Babysitter, Stundenlohn, Erfahrung, Stundenlohn, Wenn, Babysitter, App, Die Stunden Ihrer Anfrage, Bedarf, Wenn Sie, Stunden, Sitter, Einfach, Buchung, Natürlich, Sie Ihre Buchung, Sorge, Wir, Gebühren, Buchung, Entfernen Sie, Ihre Buchung, Sie, Zweitens, Verliert Ihr Babysitter, Zerbricht, Lampe, Auto, Kratzer, Dann, Erfahren Sie, Babysitter Stellen Sie, Anfrage Und, Sie Ihren, Babysitter Erhalten Sie, Bewertungen Buchen Sie, Ihre, Start, Stellen Sie Ihre Anfrage Lesen Sie, Ich, Willemijn Sneyder, Gastfamilien Read, Kinder Ein, Frühstück, Rezepte, Bildung Read, Für Eltern Au Pair, Babysitter, Babysitter, Bucht, Babysitter Für Au Pairs, Babysitter Au Pair, Babysitter Jobs Finde, Familie Über, Stellenangebote Blog Hilfe Kontakt Hilfe Erhalte Updates, Rabatte Name, Kontakt"
"Rp-Online","https://rp-online.de/nrw/panorama/babysitter-finden-tipps-fuer-sichere-kinderbetreuung_aid-85937981","babysitter","","","","Babysitter, Kinderbetreuung Rheinische Post Online Hauptmenü, Panorama Kultur Meinung Wirtschaft Leben Abo, Kinderbetreuung Sichere Kinderbetreuung So, Babysitter Köln, Viele Eltern, Sorge, Grenzen, Gewalt, Worauf, Babysittern, Nachwuchs, Pleul Eine, Person, Kinder, Dazu, Pädokriminelle, Gerade, Babysitter, Die Landesfachstelle, Gewalt, Tipps, Suche, Babysitter, Berufe, Lebensbereiche, Kindern, Nadine Jastfelder, Bereich, Täter, Gewalt, Wir, Tipps, Worauf, Auswahl, Babysitters, Bitten Sie, Daten, Person, Erfahrung, Umgang, Bereichen, Person, Eltern, Führungszeugnis, Woran, Kennenlerngespräch, Person, Eindrücke, Kommt, Person, Gespräch, Macht, Eindruck, Kinder, Kontakt, Nähe, Distanz, Kinder, Person, Person, Klingt, Kinder, Betreuungsperson, Kinder, Ebenso, Haltung, Betreuungsperson, Passt, Kinder, Regeln, Eltern, Dazu, Geheimnisse, Keine, Person, Fotos, Die Fachstelle, Wenn, Rahmen, Regeln, Zeit, Kinder, Die Kinder, Kinder, Eltern, Gefühl, Damit, Gefühl, Betreuungsperson, Besser, Kind, Kinderschutzbund, Einschätzung, Schritte, Die Landesfachstelle, Betreuungsperson, Vermutungen, Sollte, Taten, Meistgelesen Neueste Artikel Zum Thema Aus, Ressort Rettungshubschrauber, Kleinkind, Kleinkind, Ferne Bekannt, Goodbye Deutschland, Ferne Aufregung, Schreiben, Kreis Kleve, Missbrauch, Schreiben, Kreis Kleve Aldi, Düsseldorfer Kunden, Teils, Kassen, Aldi, Düsseldorfer Kunden, Leiche Ehemaliges Clubhaus, Freeway Riders Rheinberg, Leiche Bundesweite, Pflege Ermittler, Münster Bundesweite, Pflege, Sicherheitskontrolle Am Flughafen, Sicherheitskontrolle Schwangere, Baby, Tatverdacht Ermittlungen, Baby, Tatverdacht Asbest, Folgen Schadstoffbefund, Folgen Polizeihund, Frau, Frau, Babysitterinnen, Fachwissen Jugend, Babysitterinnen, Fachwissen Drittes, Wieder, Babysitter, Gericht Prozess, Babysitter, Gericht So, Babysitter, Babysitter, Ausgebildete Babysitter, Babysitter, Einbruchschutz Diebe, Weihnachtszeit Polizei Duisburg, Einbruchschutz Polizei Duisburg, Einbruchschutz Diebe, Weihnachtszeit Polizei Duisburg, Einbruchschutz So, Kindern, Fieber Tipps, Kindern, Fieber Zweijährige, Kind, Null Grad, Nach Missbrauchsvorwürfen, Weihbischof SPD, Fest, Liebe, Streit, Ärger, Neusser Weihnachtsbaum Wenn, Fest, Liebe, Streit, Schlag, Cyberbande Drei Haftbefehle, Schlag, Cyberbande Darum, Bonn, Lesotwins, Bonn, Messer, Messer, Haftstrafe, Herne Zwei Kinder, Haftstrafe, Herne Erste, Jahres Filiale, Erste, Jahres Staatsanwaltschaft, Gemeinde Ostbevern, Urkundenfälschung Staatsanwaltschaft, Gemeinde Ostbevern, Gemeinde Ostbevern, Urkundenfälschung Staatsanwaltschaft, Gemeinde Ostbevern, Messer, Gleichaltrige, Messer, Gleichaltrige, Paketzusteller, Paketzusteller, Sternenbilder, März Himmelsspektakel, Sternenbilder, März Soziale Medien, Stellenmarkt AzubiNRW RP Trauer RP Immobilienmarkt Verlag Rheinische Post Mediengruppe Karriere, Kontakt Datenschutz, Werbung, Widerruf, Panorama NRW Schule Städte Landespolitik Landtagswahl, Kultur Freizeit, Verkehr Datenjournalismus Karneval, Anzeige Politik Deutschland News, Berlin Bundestagswahl, Ukraine Sport Fußball Borussia Mönchengladbach Fohlenfutter Fortuna Statistiken, Bundesliga Champions League Europa League, Teams, Teams Alles, Italien Spanien, Tennis Olympia, Hockey Hockey EM Lokalsport Panorama Deutschland Coronavirus Ausland Leute Fernsehen Wissen Bildung, Hochschule Forschung Klima Weltraum Mode Adel Religion, Anzeige Kultur Kunst Musik Film Buch Veranstaltungstipps, Anzeige Wirtschaft Unternehmen Finanzen Digital Smartphones, Fahrrad Motorrad News, Garten Beruf Familie Gesundheit Ernährung, Diät Fitness Laufen, Joggen Medizin, Vorsorge Psychologie Schwangerschaft Sexualität, Liebe, Kochen Reisen Deutschland Fernreisen Hotels Inseln Kreuzfahrten Mallorca Urlaub News, Rente Steuern Verbraucher Versicherungen Vorsorge Mediathek, Tiere Presseportal, Anzeige, Anzeige Nachhaltig, Bilder Bilder, Düsseldorf Videos Videos, Politik, Woche Themen Services Kontakt, Podcast, Digitales Archiv Zeitungsarchiv, Aktion Zeitungspate RP Online Dating RP Stellenmarkt"
"Fbs-Marburg","https://www.fbs-marburg.de/kontakt/babysitter-service","babysitter","06421 17508-0, 06421 17508-0, 06421 17508-10","fbs@fbs-marburg.de, fbs@fbs-marburg.de","","Mein Konto Neues Konto Merkliste Warenkorb Warenkorb, Fügen Sie Kurse, Kursangebot Suche Menü, Kultur Persönlichkeit, Jugendliche Gesundheit, Bewegung Leben, Kindern Qualifizierung Kindertagespflege Ernährung, Kochen, Kurssuche Über, Engagierten Unsere Kursorte Arbeiten, Unsere Partner, Förderer, Freunde Projekte Mann, Raumvermietung, Kontakt Öffnungszeiten Ihr Weg, Kontaktformular, Pixabay Foto, Pixabay Sie, Kein Problem, Die, Motivierte Jugendliche, Wochenendprogramm, Familie, Jahr, Auf, Liste, Sie, Melden Sie, Unser, Ihnen, Liste, Büro, Evangelische, Marburg Tel, Geschlossen Herbsturlaub, Cookie Einstellungen Mein Konto, Noch, Konto, Registrieren Merkliste Die Merkliste, Stammhörer, Bitte, Sie, Anmelden Noch, Konto, Registrieren, Leserin, Leser, Angebote, Vorgaben, Ihre, Gemäß, Ihnen, Kontaktdaten, Verfügung, Ihre Anfrage, Mit, Übermittlung, Sie, Name Vorname, Bemerkung Ich, Angebote, Zwecke, Werbung, Zwecke, Die Datenschutzerklärung, Auskunftserteilung, Ihrer Person, Daten, Gemäß, Berichtigung, Löschung, Daten, Sie, Angaben, Gründen, Einwilligungserklärung, Wirkung, Zukunft, Sie, Wir, Selbstverständlich, Sie, Link, Ihnen, Klick, Hier, Sie, Schließen"
"Familienservice-Rundum","https://familienservice-rundum.de/babysitter","babysitter","2739179, 039203 753910, 039203 753919, 58 8105 5000 3400 0279 60","info@liba-bemb.de","","Babysitter, Babysitter, Babysitter Familienservice, Menü, Landkreis Börde, Babysitter Kinderbetreuung, Vertrauenssache Die Babysitter, Pools, Rahmen, Prüfung, Kenntnisse, Ersten Hilfe, Kind, Gesundheit, Umgang, Häufig, Alle Babysitter, Auf, Karte, Babysitter, Nutzen Sie, Ihren Erwartungen, Person, Auf Nachfrage, Auskünfte, Bitte, Babysittern Kontakt, Treffen, Wenn, Chemie, Babysitter, Sollten Sie, Marktplatz, Babysitter, Elternweiterführende Informationen, Babysitter Sortieren, Barleben, Barleben, Magdeburg WeiterTheresaBabysitterBarlebenBeschreibunggeb, Barleben, Magdeburg WeiterJolinaBabysitterBarlebenBeschreibunggeb, Barleben, Barleben WeiterMaritaBabysitterBarlebenBeschreibunggeb, Barleben, Bornstedt, Babysitter Suchen Kontakt, Mehr, Rechtliches Impressum Datenschutz, Kreissparkasse BördeIBAN, Rahmen, Mitteln, Landkreises Börde, Mehr, Dienst Google Maps, Sie, Akzeptieren Ablehnen Weitere Informationen"
"Kitarechtler","https://kitarechtler.de/2021/09/29/101kitafragen-darf-der-traeger-das-private-babysitten-verbieten/","babysitter","21 808 787, 44 045 652","kanzlei@kitarechtler.de","","Träger, Babysitten, Die Kitarechtler Menü Kanzlei Deutschlandweit Für, Eltern, Medien Blog Fortbildungen Referenzen, Kontakt Impressum Datenschutzerklärung, Träger, Babysitten, Träger, Babysitten, Antwort Kurzfassung, Grundsätzlich Ja, Langfassung, Wollen Erzieher, Arbeitsverhältnisses, Freizeit, Kind, Frage, Übersicht, Grundsätzlich, Träger, Denn, Kinderbetreuung, Und, Kunden, Rechnung, Ein, Regelung, Nachgehen, Nebentätigkeit, Babysitten, Einwilligung, Damit, Träger, Dabei, Sicht, Träger, Einwilligung, Denn, Frage, Träger, Beziehung, Rolle, Träger, Distanz, Erzieher, Distanz, Arbeit, Kita, Erwartung, Wichtig, Regelung, Träger, Denn, Hergeleitet, Tipp, Tatsächlich, Träger, Erzieher, Babysitten, Denn, Seiten, Abend, Ruhezeiten, Und, Wissen, Worte, Fragen, Kitarecht, Rufen Sie, Ihre, Folgen Sie, Träger, Babysitten, Holger Klaus, Zwischenzeugnis, Träger, Für Kitaträger Für, Eltern Für, Workshops, Seminare Referenzen Datenschutz, Kita, Unsere, Unfallkassen Über, Kontakt, Sie, Schnellauswahl, Beratung Datenschutz, Kita Über, Kontakt Berlin, Berlin Fehrbelliner, Mitte, Hamburg, Halle Besprechungsraum, Die Kitarechtler Unterstützt, Cookies, Besuchererlebnis, Sie, Nähere Infos, Cookies Policy Schließen Datenschutz Überblick Diese Website, Ihre Nutzererfahrung, Seite, Es, Seite, Ihnen, Inhalte, Sie, Notwendig, Notwendige Cookies, Basisfunktionen, Nicht, Solche Cookies, Website, Zwecke, Einbetten"
"123Formbuilder","https://www.123formbuilder.com/free-form-templates/Babysitter-Emergency-Contact-Form-4674903/","babysitter","300081, 2024 123","","","Free, Babysitter Emergency Contact Form Template Skip, Online Form Builder, Forms Online Form Analytics, Product Field Forms, Email Notifications, Salesforce Admins Integrations Salesforce Wix Shopify Stripe Square, Type Agreement Forms, File Upload Forms Incident Report Forms Inquiry, Quizzes Quote, Food, Beverage Forms, Small Business, Nonprofit Forms, Nonprofit Large, Sales Human, Insurance Forms Login, Babysitter Emergency Contact Form, Babysitter Emergency Contact Form Start, Available, Grab, Free Preview, Couples Survey Use, Free Preview, Marriage Survey, Free Preview, Personal Finance, Free Preview, Monthly Personal Budget Form, Free Preview, Relative Funeral Leave, Free Preview, Halloween Quiz Leave, Paid, Online RSVP Form See, Free Preview, Motor Vehicle Transfer Form Add, Free Preview, Santa, Free Preview, Homeschool Attendance Form Keeping, Free Preview, Weight Loss Tracking, Free Preview, Personal Information Form Add, Product Product, Cognito Forms, Microsoft Forms, Feedback, Features Increase, Product Field Mobile Forms Form Analytics Email Notifications File Upload Conditional Logic Calculations Integrations Salesforce Google Sheets Wix, Us Contact Careers Media Kit, Managed File Transfer, Fructus Plaza"
