"Company Name","Url Link","Keyword Selected","Phone","Email","Address","Person Name"
"Kita","https://www.kita.de/wissen/babysitter-babysitting/","babysitter","","","","Babysitter, Infos, Ratschläge, Vergleich Test, Länder Eltern Elterngeld Erzieherin Gesundheit Kinder Kinderbetreuung News Schwangerschaft Neu Anmelden Login Träger Wissen Test, Vergleich Ratgeber Musterkita Baukindergeld Bund, Länder Eltern Elterngeld, Babysitter Babysitter, Das, Dana Fritz, Aktualisierung, Wie, Babysitter, Der Vorteil, Agenturen, Suche, Hilfe, Babysitter, Babysitterin, Faktoren, Bezahlung, Babysittern Beachtung, Dabei, Kinder, Woche, Erfahrung, Rolle, Welche, Ein Babysitter, Sowohl, Vorteil, Minijob, Ihrem Partner, Freunde, Suche, Babysitter, Dieser, Ihre Liebsten, Umgebung, Sie Ihre, Babysitter Ihre Kinder, Stunden, Woche, Babysitter, Antwort, Fragen, Sie Babysitter, Bezahlung, Außerdem, Ihnen, Informationen, Weiterführende Literatur, Den, Babysitter, Die Qualifikation, Tipps, Umgang, Babysittern4, Den Babysitter, Rechtliche Details, Wichtige Fragen, Antworten7, Weiterführende Literatur, Den, Babysitter, Vertrauen, Stelle Babysitter, Obwohl, Kandidaten, Fällen, Schüler, Stunden, Woche, Die Vorteile, Sie, Person, Erkundigen Sie, Kinder, Eine, Zeitungen, Sie, Der Nachteil, Fällen, Sonderstellung, Sie, Die Vermittlung, Fällen, Sie, Auf, Portalen, Familien, Empfehlenswerte Agenturen, Babysitter24, Babysitting24, Schweiz, Die Anmeldung, Regel, Wenn Sie Betreuung, Sie, Chancen, Sie, Anzeige, Durch Filterfunktionen, Kriterien, Wenn Sie, Kontakt, Babysitter, Vermittlungskosten, Nach, Dieser, Chemie, Ihren Kindern, Babysitter, Das Wichtigste, Gefühl, Babysitter, Tipp, Manche Kinder, Geben Sie Ihrem Kind, Zeit, Die Qualifikation, Babysittern Wer, Diplom, Babysitter, Person, Die Sorgen, Manche Eltern, Gefühl, Babysitter, Kinderbetreuung, Ich, Babysitten, Benötige, Ausbildung, Ausbildung, Babysitter, Die, Jugendlichen, Erwachsenen, Nebenjob, Geld, Verschiedene Organisationen, Deutsche Rote Kreuz, Babysitter, Umgang, Kindern, Unfällen, Zudem, Tipps, Viele Eltern, Person, Betreuung, Viel, Verhältnis, Ihr Kind, Tipps, Umgang, Babysittern Der, Umgang, Klima, Jugendlichen, Abgesehen, Nebenverdienst, Daher, Respekt, Verhältnis, Babysitter, Um, Vorab, Aufgaben, Babysitter, Haushalt, Damit, Dort, Gehalt, Damit, Babysitter, Notfällen, Unfällen, Sie, Schreiben Sie, Auf, Checkliste, Uhrzeiten, Kinder, Rituale, Kinder, Eine, Eltern Notrufnummern, Notarzt, Kinder, Kinder Uhrzeiten, Mahlzeiten, Den Babysitter, Jeder, Arbeit, Leistung, Aber, Bezahlung, Gehalt, Kinderbetreuung, Familie, Euro Stundenlohn, Vorstellung, Gehalt, Zunächst, Rolle, Während, Stadt, Durchschnitt, Lohn, Berlin, Hamburg, Konkurrenz, Babysitter, Ein, Kriterium, Jugendliche, Stunde, Stundenlohn, Sie, Gehalt, Dann, Person, Mädchen, Erfahrung, Kinderbetreuung, Kenntnisse, Bei, Bezahlung, Rolle, Kinder, Zuletzt, Kinder, Babysitter, Regel, Von Belang, Kinder, Aufgaben, Dabei, Arbeiten, Haushalt, Einkäufe, Entscheiden Sie, Stundenlohn Sie Ihrem Babysitter, Falls Sie, Lohn, Sie, Einen, Stundenlohnrechner, Zudem, Babysitter, Überblick, Lage, Einsatzortes Alter, Erfahrung Anzahl, Kinder Umfang, Rechtliche Details, Bei, Wenn, Babysitter, Babysittings, Sie, Gedanken, Details, Dadurch, Babysitter, Haftung, Versteuerung Gedanken, Haftung Normalerweise, Eltern, Aufsichtspflicht, Ihre Kinder, Die Aufsichtspflicht, Kinder, Schäden, Sie Ihr Kind, Blick, Die Aufsichtspflicht, Babysitter, Dauer, Diese Übertragung, Wenn Sie, Sie, Aufsichtspflicht, Damit, Babysitter, Mit, Kind, Um, Risiko, Kinderbetreuer, Kinderbetreuerin, Orte, Kind, Wenn, Babysitter, Babysitter, Damit, Babysitter, Wenn, Vase, Jugendliche, Fällen, Dieser Schutz, Passus Betreuung, Auftrag, Entgelt, Wenn Babysitter, Dabei, Rolle, Babysitter, Weg, Babysittern Babysitter, Damit, Sie, Die Anmeldung, Vorteilen, Zunächst, Anmeldung, Dadurch, Schadensfällen, Die Anmeldung, Das Formular, Sie, Website, Dazu, Daten, Daten, Ein, Vorteil, Ausgaben, Betrag, Sie, Kosten, Sie, Die Bezahlung, Wichtige Fragen, Antworten Ab, Alter, Babysitter, Bereits, Alter, Mädchen Babysitten, Die Dauer, Babysitter, Schulferien, Tag, Gibt, Ein Beispiel, Babysitter, Vorteil, Kosten, Babysitter, Kinder, Kann, Babysitter, Natürlich, Sie, Weiterführende Literatur, Ravensburger Buch, Kinderbeschäftigung, Bewegung, Gestalten, Sprache, Basteln, Musik, Kinder, Mit Händen, Papier, Die, Kinderspiele, Kinder, Lebrun, Jim Knopf, Knifflige Abenteuer, Durchschnitt, Babysitter, Das, Antonio Guillem/shutterstock, Monkey Business, Claudio Divizia/shutterstock, Africa Studio/shutterstock, Mila Supinskaya, Pierre Yu/shutterstock, Wir, Ihren Kommentar Antworten, Erforderliche Felder, Kommentar, Ihr Name, Ihre, Verwandte Beiträge Familienhilfe, Sie, Eine Elterninitiative, Eltern, Erziehungszeit, Sie, Kinder, Erziehung, Eltern, Kind, Neugeborenes, Geburt, Steuerklärung, Suche Die, Artikel Das Babyzimmer, Alles Wissenswerte, Richtfest Elternabend, Einladung, Gestaltung Packliste, Tipps, Schüler Kinder, Eltern, Hilfen, Entwicklung Top, Anzeige Kategorien Bastelideen Baukindergeld Bund, Länder Eltern Elterngeld Entwicklung Ernährung, Kindergarten Finanzen Freizeit Gesundheit Grundschule Gruppenspiele, Kita Kinder Kindererziehung Kinderkrankheiten Kinderbetreuung Pädagogische Konzepte Recht Schulanfang Schwangerschaft Vor, Schwangerschaft Während, Schwangerschaft Nach, Schwangerschaft Linktipps, Antworten Glossar Kontakt Bildnachweise Nutzungsbedingungen Datenschutzerklärung Allgemeine Verhaltenshinweise"
"Babysitting24","https://babysitting24.ch/de?gad=1","babysitter","","","","Liebevolle, Kinderbetreuung, Nannys, Tagesmütter, Babysitting24, Babysitting24 Kinderbetreuung, Babysitter, Nannies, Tagesmütter, Schweiz Login Sprache English Deutsch Français Italiano Babysitter, Italiano Hilfe So, Anstellung Login Registrieren Babysitter, Liebevolle Babysitter, Tagesmütter, Schweizer Plattform Ich, Kinderbetreuung Ich, Bewertung Ø Bewertung, Sie, Art, Jetzt, Wir, Innerhalb, Stunden, Babysitter, Nannys, Ihnen, Babysitter, Sie, Person, Ihrer Familie, Unser Angebot Führende Schweizer Plattform, Grösste Auswahl, Schweiz Erste Bewerbungen, Minuten, Ausführliche Profile, Fotos, Referenzen, Schweiz Kinderbetreuung, Schweiz Seit, Tagesmütter, Nannys, Babysitter, Tagesmütter, Suche, Kinderbetreuung Babysitter, Schweiz Basel Bern Genf Lausanne Luzern Sankt Gallen Winterthur Zug Zürich Kinderbetreuung, Nähe, Probieren Sie, Kinderbetreuung, Babysitting24 Dank Babysitting24, Babysitterin, Ich, Haus, Kinder, Sandra, Zürich Bei Babysitting24, Baby, Ich, Arbeit, Anna, Babysitterin, Manuela, Basel Dank Babysitting24, Babysitterin, Ich, Haus, Kinder, Sandra, Zürich Bei Babysitting24, Baby, Ich, Arbeit, Anna, Babysitterin, Manuela, Basel Mehr Informationen, Eltern Wie, Babysitting24, Babysitter, Nanny, Babysitter, Nanny, Tagesmutter, Wie, Babysitter, Nanny, Wie, Babysitting24, Familien, Babysitter, Nannys, Babysitter24, Babysitting24, Ausführliche, Fotos, Referenzen, Familien, Babysittern, Nannys, Sichere Nachrichtenfunktion, Ausführliche, Möchten Sie, Ihnen, Babysitter, Nanny, Babysitting24, Art Kontaktdatenbank, Kinderbetreuer, Babysitting24, Erstellen Sie, Jobangebot, Sie, Ist Ihr Jobangebot, Sie, Minuten Bewerbungen, Wenn Sie, Sie, Person, Sie, Erstgespräch, Kennenlernen, Vorteile, Babysitting24, Anbietern, Schweiz, Jahren Familien, Babysittern, Nannys, Einfach, Babysitter, Nannys, Erfahrung, Familien, Mit, Babysitting24, Beispiel, Ihre Kinder, Bei, Betreuung Ihrer Kinder, Denn Sie, Ihrer Familie, Ihre Lohnzahlungen, Den Lohn, Nanny, Weil, Sie, Lohn, Wir, Sie, Ihnen, Arbeitstagen, Unterschied, Babysitter, Nanny, Kinder, Bedarf, Familien, Häufig, Auch Nannys, Haushalt, Kinder, Familien, Babysitter, Nanny, Babysitter, Nannys, Den Stundenlohn, Person, Möchten Sie, Richtwert, Sie, Babysitting24, Aspekte, Dazu, Beispiel, Alter, Höhe, Wird, Nanny, Minuten, Schritt, Anmeldung, Ihnen Fairboss, Wichtige, Blick, Anstellung, Babysitting24 Sicherheit, Bei Babysitting24, Zum Beispiel, Unsere Babysitter, Nannys, Zusätzlich, Profil, Suchen Sie Kinderbetreuung, Darum, Babysitter, Nannys, Jobs Seit, Schweiz, Kinder, Unsere Babysitter, Nannys, Sternen, Wir, Tiersitter, Nachhilfe, Person, Schweiz, Account, Mehr, Sie, Kinderbetreuung Kinderbetreuung Weitere Services Wir, Bereichen, Nachhilfeunterricht Auf Tutor24, Schülerinnen, Schüler, Haushaltshilfen, Haushalte, Haustierbetreuung Auf Petsitting24, Hunde, Katzen, Vögel, Menschen, Kontakt Über, Sitemap EN DE, Bern Kinderbetreuung Genf Kinderbetreuung Lausanne Kinderbetreuung Luzern Kinderbetreuung Sankt Gallen Kinderbetreuung Winterthur Kinderbetreuung Zug Kinderbetreuung Zürich Kinderbetreuung Schweiz Babysitter Babysitter Basel Babysitter Bern Babysitter Genf Babysitter Lausanne Babysitter Luzern Babysitter Sankt Gallen Babysitter Winterthur Babysitter Zug Babysitter Zürich Babysitter Schweiz Tagesmutter Tagesmutter Basel Tagesmutter Bern Tagesmutter Genf Tagesmutter Lausanne Tagesmutter Luzern Tagesmutter Sankt Gallen Tagesmutter Winterthur Tagesmutter Zug Tagesmutter Zürich Tagesmutter Schweiz Nanny Nanny Basel Nanny Bern Nanny Genf Nanny Lausanne Nanny Luzern Nanny Sankt Gallen Nanny Winterthur Nanny Zug Nanny Zürich Nanny Schweiz Weitere Services Kindermädchen, Kinderfrau Tagesfamilie, Babysitter Jobs Leihoma Unsere"
"Studiwork","https://www.studiwork.com/job-und-karriere/kinderbetreuung-so-gestaltest-du-dein-profil-als-babysitter-attraktiv/","babysitter","","","","Babysitter Profil, Anmelden Menü Anmelden Unser Angebot, Hilfskräfte Mehr, Kontakt Kinderbetreuung, Blog, Kinderbetreuung, Babysitter, Eltern, Bedeutung, Dabei, Rolle, Vertrauen, Eltern, Ein, Relevanz, Babysitter, Angebot, Eltern, Dabei, Aspekte, Bedeutung, Tipps, Außerdem, Umgang, Rolle, Möglichkeiten, Weiterentwicklung, Babysitter, Ziel, Tipps, Bedeutung, Babysitter, Eltern, Hände, Babysitter, Ein, Eindruck, Person, Vorstellung, Person, Hier, Ausbildung, Hobbys, Eindruck, Persönlichkeit, Überblick, Kinderbetreuung, Erwähne, Bereich, Betone, Kenntnisse, Bedürfnissen, Wert, Kinderbetreuung, Zeige, Fähigkeit, Kinder, Betone, Kindern, Geschichten, Spiele, Hausaufgaben, Zeige, Kinder, Wenn, Babysitter, Referenzen, Eindruck, Person, Fähigkeiten, Inhalte, Rolle, Aspekte, Wähle, Achte, Bild, Kleidung, Namen, Alter, Vermeide, Stelle, Bereich, Nenne, Anzahl, Jahre, Babysitter, Das, Malen, Basteln, Musizieren, Hausaufgabenbetreuung, Tagen, Uhrzeiten, Eltern, Wochenende, Wenn, Kinderbetreuung, Das, Muttersprache, Erziehung, Falls, Referenzen, Positive Bewertungen, Babysitter, Hebe, Geduld, Verantwortungsbewusstsein, Zeige, Vorlieben, Kinder, Eltern, Babysitter, Situationen, Stelle, Kontaktdaten, Auswahl, Babysitters, Angaben, Teil, Babysitter, Hier, Kenntnisse, Folgende Punkte, Babysitter, Babysitter, Nenne, Kinder, Dauer, Betreuung, Aufgaben, Verantwortlichkeiten, Kenntnisse, Wenn, Kenntnisse, Beispiel, Kinder, Zusatzausbildung, Eltern, Wert, Babysitter, Kinder, Kinderbetreuung, Das, Malen, Basteln, Musizieren, Hausaufgabenhilfe, Planen, Falls, Umgang, Allergien, Behinderungen, Eltern, Babysitter, Kommunikationsfähigkeiten, Eltern, Wohlbefinden, Kinder, Wenn, Babysitter, Aspekte, Babysitter, Bedeutung, Schlüsselkomponenten, Auswahl, Babysitters, Bedeutung, Abschnitt, Babysitter, Babysitter, Die Betreuung, Kinder, Verantwortungsbewusstsein, Zeige, Zeit, Babysitter, Kinder, Auge, Gehe, Halte, Kinder, Laufenden, Ereignisse, Vertrauen, Familie, Eltern, Babysitter, Aufgaben, Pläne, Zeige, Bereitschaft, Verantwortung, Kenne, Sei, Eltern, Babysitter, Ruhe, Kinder, Verantwortungsbewusstsein, Babysitter, Diese Eigenschaften, Wert, Tipps, Wähle, Vertrauen, Achte, Informationen, Namen, Ausbildung, Kinderbetreuung, Halte, Umgang, Hast, Basteln, Spielen, Kinderbetreuung, Nenne, Kinder, Art, Betreuung, Betreuung, Nachhilfe, Erwähne, Herausforderungen, Wenn, Babysitter, Positive Empfehlungen, Einfluss, Uhrzeiten, Kinderbetreuung, Zeige Flexibilität, Zeitplan, Eltern, Wenn, Beispiel, Musik, Wenn, Sprache, Eltern, Kinder, Chancen, Arbeitgebern, Denke, Profil Vertrauen, Professionalität, Umgang, Babysitter, Tipps, Schnelle Reaktion, Versuche, Kundenanfragen, Babysitter, Antwort, Kunden, Verwende, Sprache, Grammatik, Beantworte Fragen, Wünsche, Familie, Frage, Kinder, Wenn, Beispiel, Erfahrung, Erwartungen, Versprechungen, Vorstellungsgesprächen, Wenn, Treffen, Bereite, Fragen, Vorstellungsgesprächen, Vorstellungsgespräch, Treffen, Familie, Zusammenarbeit, Du, Tagen, Gespräch, Wenn, Familie, Zeige Verständnis, Umgang, Fragen, Eindruck, Chancen, Rolle, Rolle, Babysitter, Punkte, Bemühe, Referenzen, Kunden, Das, Babysitter, Personen, Frage, Bereitschaft, Arbeit, Familie, Ein, Schreiben, Kunden, Apps, Babysitter, Nutze, Eltern, Feedback, Vertrauen, Kunden, Stelle, Kunden, Wenn, Referenzen, Kunden, Beachte, Familien, Veröffentliche, Namen, Zustimmung, Halte, Familien, Bewertungen, Einfluss, Kunden, Vertrauen, Hände, Sorge, Chancen, Vermittlungen, Weiterentwicklung, Besuche, Risiken, Bereich, Kinderbetreuung, Schulungen, Wissen, Babysitter, Wissen, Ansätze, Besuche Seminare, Workshops, Bildung, Wenn, Sprache, Eltern, Babysitter, Sprachen, Babysittern, Nutze Foren, Hier, Tipps, Bemühe, Stärken, Nutze, Fähigkeiten, Babysitter, Kinder, Entwicklung, Babysitter, Babysitter, Bedeutung, Kunden, Vertrauen, Darstellung, Betonung, Nutze, Umgang, Geduld, Chancen, Zusammenarbeit, Rolle, Achte, Babysitter, Indem, Kenntnisse, Nutze, Feedback, Stärken, Entwicklungsbereichen, Babysitter, Mit, Betonung, Bereitschaft, Bereich, Kunden, Babysitter, Anzeichen, Angst, Berufsalltag, Job, Gedanken, Nahezu, Zweite, Kündigung, Es, Bist, Wandel, Entwicklung, Tipps, Tipps, Menschen, Arbeitsmodelle, Berufseinstieg, Leistung, Jobsuchende So, Weiteres Hilfe, Kontakt Registrieren Geschäftskunden Partner Bedingungen Impressum Datenschutz, Cookies AGB, Links StudiBlog Zahlungsmethoden Social Media Sprache Deutsch Copyright, Alle Rechte, Einige, Erfahrung, Notwendig Notwendig Immer, Zugang, Zweck, Nutzer, Zweck, Nachricht, Vorlieben Vorlieben Die, Zugriff, Zweck, Speicherung, Benutzer, Statistik Statistik Die, Zugriff, Zwecken, Zugriff, Zwecken, Ohne, Vorladung, Aufzeichnungen, Zweck, Die, Zugriff, Werbung, Website, Verwalten, Zwecke Akzeptieren Ablehnen Einstellungen Speichern Einstellungen"
"Aboutyou","https://ir.aboutyou.de/websites/about-you/German/9998/impressum.html","babysitter","10
20095, 170972, 341641169, +49 40 638 569","info@aboutyou.de","","Us Märkte, Hinweisgebersystem Eigenmarken Security Konferenzen Planet People Society Wholesale, Kultur Unsere Jobs Unsere Departments, Online Marketing, Fashion Trainee Programm Job Alert, Börsengang Aktie News Finanzpublikationen Media Board, Kontakt Über, Märkte Vorstand Compliance Eigenmarken Investoren Security Konferenzen Verantwortung Society People Planet B2B Solutions Tech Services Retail Media Solutions Partner Solutions Karriere Unsere Kultur Unsere Jobs Tech, Börsengang Aktie News Publikationen, Kontakt EN, Sebastian Betz, Tarek Müller, Hannes Wiese Aufsichtsratsvorsitzender, Sebastian Klauke, Märkte Vorstand, Brand Relations, Retail Media, Partner Modelle Wholesale, Kultur Unsere Jobs Investor Relations, Börsengang Aktie News, Board Finanzkalender Governance Hauptversammlung Kontakt Newsroom"
"Kinderschutzbund-Langenfeld","https://kinderschutzbund-langenfeld.de/babysitterdienst/","babysitter","20899-13, 20899-13, 15-1940764, 02173 20899-10, 02173 20899-29","info@dksb-langenfeld.de, p.thiele@dksb-langenfeld.de, info@dksb-langenfeld.de","","Babysitterdienst, Babysitter, Angebote Offener Elterntreff, Kinderschutz PEKiP, Umgang Babysitterdienst Betreuung, Offener Ganztag, Verwaltung, Der Vorstand Unterstützer Jobs Kontakt, Kinderschutz PEKiP, Umgang Babysitterdienst Betreuung, Offener Ganztag, Verwaltung, Der Vorstand Unterstützer Jobs Kontakt, Babysitterdienst Bei, Mädchen, Jungen, Schule, Sie, Wunsch, Unsere Babysitter, Babysitterausbildung, Kontakt, Babysitter, Nähe, Eltern, Fällt, Babysitterdienst, Heimweg, Babysitter, Die Kosten, Weitere Informationen, Sollten Sie, Sie, Namen, Babysitterkurs Info Der Babysitterkurs, Samstag, Ein, Termin, Kurs, Kosten, Kursunterlagen, Die Themen, Entwicklung, Ernährung, Pflege, Krankheit, Notfällen, Kinder, Anzahl, Anmeldung, Kontakt, Impressum Datenschutzerklärung Menü Kontakt, Impressum Datenschutzerklärung, Telefon, Töller Service Langenfeld"
"Molyvosalkyonis","https://www.molyvosalkyonis.com/","babysitter","","","","Molyvos Alkyonis, Lesbos, Molyvos Alkyonis, Eine, Hand, Ortseingang, Umgeben, Studios, Ruhe, Willkommen, Natur, Gelände, Katzensprung, Pool, Dorf, Verlasse, Alltags, Umgebung, Molyvos, Sprich, Deutsch, Wir, Entdecke Ruhe Die Oase, Eingang, Garten, Hängematte, Grillplatz, Pergola, Dorfmitte, Tavernen, Cafés, Parkplätze, Haus, Verfügung, Schau, Unsere Studios Alle Studios, Terrasse, Dusche, Flat Screen, Kaffeemaschine, Verfügung, Auf Wunsch, Babybett, Schau, Die Apartments, Studios, Raum, Großzügige Räume, Verfügung, Schau, Pouwels Pure Photography Impressum"
"Vero","https://www.vero.fi/en/About-us/contact-us/","babysitter","","","","Virtanen, Instagram, Local, Postal, Feedback Maintenance, Feedback Maintenance, Request, Incomes Register Contact, Forms, Tax Administration Data"
"Kidsit","https://kidsit.com/babysitters","babysitter","","","","Main Menu Babysitters Pet, Free Including, Plenty Auckland Christchurch, Otago New Plymouth, Taranaki Paihia, Plenty Pakaraka, Plenty Whanganui Active Babysitters Rebecca Chaska, Babysitter, Josephine Hongsermeier Phoenix, Babysitter Service, Pruett Omaha, Babysitter, Amelia Johnson Lilburn, Babysitter Jessica Portsmouth, Babysitter, Joshua Jaramillo Lakewood, Babysitter, Tania Hawthorn, Babysitter Dean Hunter Newcastle, Babysitter, Emily Servin Murrieta, Babysitter, Babysitter, Alyssa Trybus Las Vegas, Babysitter, Kanesha Rivens Dallas, Babysitter Service, Dog, Kimberly Lee Centerville, Babysitter, Kelsey Holmes Monroe, Babysitter, Makhia Thomas Hattiesburg, Babysitter, Lauren Stiefvater Conway, Babysitter, Allison Potasz Bridgeport, Babysitter Service, Christina Torres Rancho Palos Verdes, Babysitter Angel Grant Wilmington, Babysitter Service, Janiyah Briggs Nottingham, Babysitter, Sarah Doyle Fairport, Babysitter Shawna Penney Marystown, Babysitter, Keli Fossett New York, Babysitter Service, Haley Lynn, Babysitter, Breannie Miami, Babysitter, Kelly Davis Dunedin, Otago NZ Service, Babysitter Service, Victoria Sanchez Redlands, Babysitter, Abigail Lyew Murrieta, Babysitter, Babysitter, Rosie Darnel Louisville, Babysitter, Monica Taylor Villa Park, Babysitter, Kelly Wade Texarkana, Babysitter Service, Taranaki NZ Service, Babysitter, Tamika Amos Hattiesburg, Babysitter Emily Bielby Nashua, Babysitter Service, Kioni Spencer Greenville, Babysitter, Hoang Surrey, Babysitter Service, Donna Gough Albury, Babysitter, Savannah Gilbert Las Vegas, Babysitter Service, Alivia Martin, Babysitter, Karena Williams New Haven, Babysitter, Nathaly Rodriguez Tamiami, Babysitter, Taylor Carter Aiken, Babysitter, Ellie, Tootgarook, Babysitter, Shatecia Harmon Tacoma, Babysitter, Julia Colquitt San Antonio, Babysitter Service, Samantha Bustos Apple Valley, Babysitter, Senam Dormekpor Vaughan, Babysitter, Min Avg Max US, Kidsit, Joanna Humphrey Flynn Boston, Jump, Babysitter, Babysitter, How, Babysitter, Babysitter, Babysitter, Babysitter, Babysitter, Valentine, Kidsit Home, About Contact Newsletter, Terms Privacy Members Login, Kidsit Babysitters"
"Srk-Gr","https://babysitter.srk-gr.ch/impressum/","babysitter","+41 81 258 45 99, +41 81 258 45 89","babysitting@srk-gr.ch","","Babysitter Home Häufige Fragen, Kontakt SRK Babysitter Impressum Schweizerisches Rotes Kreuz Graubünden, Chur Kontakt, Telefon, Streitschlichtung Die Europäische, Plattform, Unsere, Impressum, Wir, Haftung, Inhalte Als, Seiten, Gesetzen, Nach, Nutzung, Gesetzen, Eine, Haftung, Zeitpunkt, Kenntnis, Rechtsverletzung, Bei Bekanntwerden, Haftung, Links Unser Angebot, Links, Websites Dritter, Inhalte, Einfluss, Deshalb, Gewähr, Seiten, Zeitpunkt, Rechtsverstöße, Rechtswidrige Inhalte, Verlinkung, Eine, Kontrolle, Bei Bekanntwerden, Urheberrecht Die, Inhalte, Seiten, Die Vervielfältigung, Urheberrechtes, Downloads, Seite, Soweit, Seite, Urheberrechte Dritter, Inhalte Dritter, Sollten Sie, Urheberrechtsverletzung, Bei Bekanntwerden, Inhalte, Datenschutz, Nutzung, Verwendung, Verstanden"
"Schuelerjobs","https://schuelerjobs.de/jobideen/babysitting-als-schuelerjob","babysitter","","","","Schülerjob HomeSchülerjobs, Bild, Babysitten, Nicht, Dennoch, Babysitter, Menschen, Und, Blick, Eignung, Babysitter, Umgang, Von Säuglingen, Babys, Zwerge, Onkel, Babysitten, Baby, Und, Tatsache, Kinder, Umgang, Baby, Liegen, Dazu, Nahrung, Temperatur, Menge, Baby, Kind, Umgang, Babys, Kenntnisse, Deutschen Roten Kreuz, Volkshochschule, Die Kosten, Schatz, Stunden, Kenntnisse, Und Zuverlässigkeit, Zeiten, Ein, Umgang, Terminen, Gleichermaßen, Absprachen, Familie, Freunde, Aushang, Vielleicht, Nähe, Aushang, Babysitter, Eindruck, Nicht, Beispiel, Baby, Solche Fragen, Nachbarn, Zum Beispiel, Bett, Tür, Kind, Mensch, Gedanken, Alles Weitere, Baby, Text, Gründen, Lesbarkeit, Umgebung, Bewerbung, Bewerbungsfoto, Bild, Schutz, Arbeit, Deine Eltern, Sorgeberechtigten, Nebenjob, Tätigkeit, Das, Euro, Steuern, Verdienst, Nebenjob, Daher, Arbeitsvertrag, Dieser, Wenn, Laufe, Beschäftigung Unstimmigkeiten, Ferienjobs"
"Sitly","https://www.sitly.ca/","babysitter","","","","Nannies, Babysitting Jobs, English Français Log, Sign Up, Sitly, Hamilton Online, Milton Online, Guelph Online, Ready, Amber, Zoé, Rachel, Anne, Sarah, Eliza, Hannah, Michaela, Jason, Sitly, Sitly, Frequently, Questions Contact Download, Sitly Sign, Facebook Apple Google, Sitly Continue, Facebook Apple Google, Email Password Forgot, Don, Reset Password Email Cookies, Sitly Welcome, Cookie Statement, Edit Preferences Accept All, Cookie Settings Do, Cookie Policy Apply Filters City Which, Mon Tue Wed Thu Fri Sat Sun Type, Clear Show, Skip, Links"
