"Company Name","Url Link","Keyword Selected","Phone","Email","Address","Person Name"
"Aboutamazon","https://www.aboutamazon.de/news/amazon-prime-und-shopping/amazon-kundenservice-kontaktieren","babysitter","1996-2022, 1996-2022","","","Wie, Mark Tumblr Twitter Youtube, Quote Close Search Right, Download Icon Whatsapp Icon, Mehr Wer, Amazon Public Policy Amazon, Schweiz Was, Mehr Was, Amazon Prime, Amazon Business Arbeiten, Mehr Arbeiten, Zusatzleistungen, Weiterbildung Sicherheit, Arbeitsplatz Besuchertouren, Amazon Unsere, Beitrag Was, Mehr Was, Unser, Beitrag Schaffung, Umwelt Mehr Unser Beitrag, Umwelt Der Climate Pledge, Klimaversprechen Nachhaltigere Betriebsabläufe Verpackungen, Wertschöpfungskette Folge, Mehr Folge, Amazon Instagram, Besuche, Europe Europe, México, Brazil, Cookie Einstellungen, Tochtergesellschaften Menü Suche, Suchbegriff Schließen Sucheinstellungen Wer, Mehr Wer, Amazon Public Policy Amazon, Schweiz Was, Mehr Was, Amazon Prime, Amazon Business Arbeiten, Mehr Arbeiten, Zusatzleistungen, Weiterbildung Sicherheit, Arbeitsplatz Besuchertouren, Amazon Unsere, Beitrag Was, Mehr Was, Unser, Beitrag Schaffung, Umwelt Mehr Unser Beitrag, Umwelt Der Climate Pledge, Klimaversprechen Nachhaltigere Betriebsabläufe Verpackungen, Wertschöpfungskette Folge, Mehr Folge, Amazon Instagram, Mehr Besuche, Europe Europe, México, Brazil, Amazon, Amazon Kundenservice, Amazon Autor, Letzte Aktualisierung, Auf Facebook, Auf Twitter, Auf LinkedIn, Per, Copy Link, Von, Amazon Autor, Auf Twitter, Auf LinkedIn, Per, Copy Link, Hier, Hilfe, Amazon Bestellung, Kindle, Echo, Alexa, Wegen, Uhr, Amazon App, Beim Amazon, Kundinnen, Kunden, Stelle, Erfahre, Weiterlesen Die Zufriedenheit, Kunden, Stelle, Wir, Jahr, Wir, Mit, Uhr Antworten, Fragen, Unser Service, Amazon Kundenkonto, Hilfe, Hilfe, Unser Kundenservice, Wegen, Hilfe, Amazon Lieferung, Wie, Abholstationen, Amazon Locker, Amazon Counter, Weiterlesen Hier, Hilfe, Amazon Bestellung, Kindle, Echo, Alexa, Wegen, Uhr, Amazon App, Beim Amazon, Kundinnen, Kunden, Stelle, Erfahre, Weiterlesen Die Zufriedenheit, Kunden, Stelle, Wir, Jahr, Wir, Mit, Uhr Antworten, Fragen, Unser Service, Amazon Kundenkonto, Hilfe, Hilfe, Unser Kundenservice, Wegen, Hilfe, Amazon Lieferung, Wie, Abholstationen, Amazon Locker, Amazon Counter, Weiterlesen Amazon Hotline Anruf, Klick, Hilfe, Kontakt, Klick, Vorteile, Lange Warteschleifen, Daten, Austausch, Amazon Kundenservice, Denn, Anruf, Klick, Amazon Kundin, Kunde, Mein Konto, Bestellung, Hilfe, Optionen, Anruf, Ziel, Deutsch, Du, Niederländisch, Polnisch, Amazon Chat Chatte, Hilfe, Amazon Bestellung, Amazon Kunde, Kundin, Hilfe, Retoure, Hol, Weiterlesen Unser, Unser, Er, Retoure, Meistens, Falls, Melde, Amazon Selbsthilfefunktionen Einfach, Antworten, Unsere, Anruf, Handhabung, Sobald, Zugriff, Infos, Lieferung, Rückgabe, Amazon, Du, Alexa, Antworten, Fragen, Amazon Produkten, Die Amazon, Fülle, Verfügung, Antworten, Fragen, Wie, Sparabo, Amazon, Wie, Amazon Bestellung, Welchen Käuferschutz, Technische Unterstützung Hast, Echos, Kindle, Kindle, Echo, Amazon Geräte, Unser Expertenteam, Infos, Amazon Geräte, Hilfe, Dienste Benötigst, Amazon Music, Erfahre, Fälle, Weiterlesen Infos, Hilfe, Amazon Music, Alexa, Wir, Abspielen, Koppeln, Lösen, Seite, Antworten, Fragen, Amazon Music, Alexa, Gerne, Chat, Wir, Ähnliche Themen, Aktueller Artikel, Wie, Auf Twitter, Auf LinkedIn, Per, Copy Link, Artikel, Echo Spot, Mehr, Amazon Amazon, Amazon Prime, Amazon App, Funktionen, Amazon Prime, Amazon Prime, Amazon Prime, Amazon Retourenkauf, Angebote, Amazon Prime, Amazon Prime, Wild, Amazon Freevee, Amazon Prime, Amazon Prime, Amazon Kreditkarte, Punkte, Amazon Visa Weiterlesen, Amazon, Cookie Einstellungen, Tochtergesellschaften"
"Vermittlung-Hamburg","http://babysitter.vermittlung-hamburg.de/ueber-uns/kontakt/","babysitter","","","","Kontakt, Babysitter Vermittlung Hamburg Babysittervermittlung Für Babysitter Für Eltern, Unser Service Kontakt Impressum, Partner, Werbung Babysitter, Mitglieder, Kontakt Wählen Sie, Kategorie Hamburg City Hamburg Nord Hamburg, Neue Anzeige, Kontakt Bitte, Sie, Anfrage, Babysitter, Nutzen Sie, Anbieter, Hilfe, Fragen, Ihnen, Schreiben Sie, Nachricht, Name, Adresse Betreff, Dein Account Registrieren Benutzername Passwort Erinnere, Anmelden Aktuelle GesucheEltern, Suche, Bab, Aktuelle BewertungenEltern, Babysitter, Hamburg Kinderbetreuung Kostenlos Langenhorn Leihoma Nanny Tagesmutter Hilfreiche, Schüler Rund, Baby Checkliste Babysitter, Händen Bundesministerium, Familie, Jugend Anzeigen Sie, Sie, Babysitter, Leihoma, Dann, Ihr Gesuch, Gesuch, Babysitter, Hamburg Kinderbetreuung Kostenlos Langenhorn Leihoma Nanny Tagesmutter Anzeigen, Partner, Werbung, Kontakt, Umsetzung, Grafikwerkstatt, Weitere Angebote"
"Schwangerinmeinerstadt","https://www.schwangerinmeinerstadt.de/informationen/familie/rund-ums-familienleben/babysitter-pro-und-contra.aspx","babysitter","2285386","","","Babysitter, Funktionsumfang, Sie JavaScript, Anleitung, Sie JavaScript, Stichwort Menü, Nützliche Adressen, Berlin Bonn Dortmund Dresden Düsseldorf Duisburg Essen Frankfurt Hamburg Hannover Köln Leipzig Magdeburg München Nürnberg Stuttgart Bitte, Sie, Stadt, Alle, Rubrik, Stadt, Adressen Behördengänge, Erledigungen Beratung Kurse Regionale Tipps Informationen Artikel, Schwangerschaft Kinderwunsch Schwangerschaft Geburt Baby, Kleinkind Kurse Familie Versicherungen Gesetzesänderungen Gelder, Anträge Beruf, Karriere Rund, Sie, Für Sie, Bücher, Blogs, Videos, Babybedarf, Möbel Gewinnspiele Tolle, Familie Urlaub Schwanger, Kind, Informationen Familie Rund, Babysitter, Near2Me, Neues Graco, Bewertung Die Sendung, Elefanten, Babysitter, Eltern, Vollen, Frage, Babysitter, Mit, Babysitter, Babysitterin, Contra, Babysitter, Wir, Ihre Überlegungen, Babysitter Schafft Freiräume, Ermöglicht, Entlastung, Babysitter, Beispiel Aufgaben, Kinder, Nachhilfe, Aufgaben, Haushalt, Absprache, Bereichert, Leben, Ein Babysitter, Ideen, Umgang, Oft, Freundschaften, Contra, Kostenfaktor, Babysitter, Vertrauenssache, Person, Vertrauen, Flexibilität, Portion Vorausplanung, Die Kinder, Babysitter, Jugendschutz, Vorfeld, Umfang Babysitter, Arbeitsverhältnis, Babysittern, Aktuelle News Donnerstag, Near2Me, Neues Graco, Donnerstag, Montag, Bewertung, Anzeige Unsere Partner Wir, Inhalte, Funktionen, Zugriffe, Außerdem, Informationen, Partner, Unsere Partner, Sie, Rahmen Ihrer Nutzung, Dienste, Ich, Kunden Datenschutz, Magazin Für Anbieter Anbieter, Kontakt Impressum, München"
"Mermaidme","https://www.mermaidme.de/pages/kontakt","babysitter","","","","Kontakt, Inhalt Dein Warenkorb, Weiter, Konto, Geschätzte Gesamtkosten, Steuern, Versand, Rabatte, Aktualisieren Auschecken American Express Apple Pay Google Pay Klarna Maestro Mastercard, Unsere Produkte Kontakt Einloggen, Albanien, Antigua, Britische Jungferninseln, Britisches Territorium, Indischen Ozean, Brunei Darussalam, Burkina Faso, Cabo Verde, Costa Rica, Dominikanische Republik, Französische Südgebiete, Karibische Niederlande, Palästinensische Autonomiegebiete, San Marino, São Tomé, Sierra Leone, Sint Maarten, Jan Mayen, Sri Lanka, Südlichen Sandwichinseln, Vereinigte Arabische Emirate, Zentralafrikanische Republik, Albanien EUR, Andorra EUR, Angola EUR, Barbuda EUR, Armenien EUR, Bahamas EUR, Bahrain EUR, Barbados EUR, Belgien EUR, Benin EUR, Bermuda EUR, Bhutan EUR, Bolivien EUR, Herzegowina EUR, Brasilien EUR, Indischen Ozean EUR, Brunei Darussalam EUR, Bulgarien EUR, Burkina Faso EUR, Burundi EUR, Rica EUR, Curaçao EUR, Dänemark EUR, Dominica EUR, Dominikanische Republik EUR, Salvador EUR, Eritrea EUR, Estland EUR, Färöer EUR, Fidschi EUR, Frankreich EUR, Gabun EUR, Georgien EUR, Grenada EUR, Guyana EUR, Haiti EUR, Honduras EUR, Island EUR, Man EUR, Italien EUR, Jamaika EUR, Japan EUR, Jersey EUR, Jordanien EUR, Kanada EUR, Karibische Niederlande EUR, Katar EUR, Kenia EUR, Kiribati EUR, Kolumbien EUR, Komoren EUR, Kuwait EUR, Lesotho EUR, Libanon EUR, Libyen EUR, Malawi EUR, Mali EUR, Malta EUR, Marokko EUR, Martinique EUR, Mauritius EUR, Mexiko EUR, Monaco EUR, Myanmar EUR, Namibia EUR, Nicaragua EUR, Österreich EUR, Panama EUR, Portugal EUR, Moldau EUR, Salomonen EUR, Sambia EUR, Samoa EUR, San Marino EUR, Príncipe EUR, Schweden EUR, Schweiz EUR, Serbien EUR, Sierra Leone EUR, Slowenien EUR, Macau EUR, Spanien EUR, Jan Mayen EUR, Lanka EUR, Barthélemy EUR, Helena EUR, Nevis EUR, Lucia EUR, Martin EUR, Miquelon EUR, Grenadinen EUR, Sudan EUR, Südlichen Sandwichinseln EUR, Tokelau EUR, Tobago EUR, Cunha EUR, Türkei EUR, Caicosinseln EUR, Tuvalu EUR, Uganda EUR, Ukraine EUR, Ungarn EUR, Vanuatu EUR, Venezuela EUR, Arabische Emirate EUR, Königreich EUR, Futuna EUR, Zypern Facebook Instagram, Unsere Produkte Kontakt Suchen Einloggen Warenkorb, Lösung, Deine Anfrage, Unser Team, Sobald Deine Bestellung, Deinem Paket, Melde, Outlet Party, Melden Sie, Ihrer, Sie, Geschenke, Quick, Shop Unsere Mission Careers Werde Markenbotschafter Allgemeine Geschäftsbedingungen Widerrufsrecht Help, Lieferzeiten Widerruf, Versand Kontaktinformationen Impressum Wenn, Auswahl, Seite, Zuerst, Wir, Anzeigen, Funktionen, Zugriffe, Außerdem, Informationen, Medien, Werbung, Mehr, Notwendige Marketing Analyse Sonstige"
"Humanitas-Pflegeservice","https://humanitas-pflegeservice.de/109-0-Babysitter+.html","babysitter","0800 42 42 800","","","Humanitas, Babysitter Schriftgröße, Kontakt, Babysitter Was, Babysitter, Kinder, Haus, Wochenende, Stunden, Kinder, Aufgaben, Hierzu, Essen, Die Qualifikationen, Babysittern, Viele, Babysitter, Erfahrung, Zur Vorbereitung, Diese Betreuungsform, Kinder, Kosten, Babysitter, Empfohlen, Anstellung, Eine, Tätigkeit, Umständen, Unsere Leistungen, Beratung, Vermittlung, Babysittern Wir, Familien Gespräche, Wünsche, Wir, Betreuungsform, Kosten, Wir, Wünschen, Wir, Überprüfung, Führungszeugnis, Gesundheitszeugnis, Wir, Wir, Fragen, Netzwerke, Kontakt, Anfahrt, Analyse, Nutzung, Website, Verwendung, Ich"
"Babysitter-Finden","https://babysitter-finden.net/kontakt/","babysitter","96 76 95 87, 1
53117, 0228-96769587, 96 76 95 87","info@kinderbetreuung-bonn.eu, info@babysitter-finden.net","Allee 1, 53117 Bonn, Allee 1, 53117 Bonn","Zum Inhalt, Unser Team Zertifikate Unser Konzept Aktuelles Kontakt Menü Startseite Unser Team Zertifikate Unser Konzept Aktuelles Kontakt Anfrage, Jan Lindner Telefon, Unsere BürozeitenMontag, Nachricht Datenschutz Mit, Nutzung, Verarbeitung Ihrer Daten, Nachricht, Anfahrt Sie, Fragen, Kontakt Kontakt, Auerberger Allee, Links Startseite Unser Team Zertifikate Unser Konzept Aktuelles Kontakt Startseite Unser Team Zertifikate Unser Konzept Aktuelles Kontakt Rechtliches Impressum Datenschutz, Impressum Datenschutz, Externe Links Kinderbetreuung Bonn, Erlebnis, Cookies, Wenn, Daten, Website, Wenn, Zugang, Zweck, Nutzer, Zweck, Nachricht, Vorlieben Vorlieben Die, Zugriff, Zweck, Speicherung, Benutzer, Statistiken Statistiken Die, Zugriff, Zwecken, Zugriff, Zwecken, Ohne, Vorladung, Aufzeichnungen, Zweck, Die, Zugriff, Werbung, Website, Anbieter, Zwecke Akzeptieren Ablehnen Einstellungen"
"Minijob-Zentrale","https://magazin.minijob-zentrale.de/minijob-babysitter/","babysitter","","","","Babysitter, Inhalt English Gebärdensprache Leichte Sprache Die Minijobs Die Minijobs Minijob, Verdienstgrenze Kurzfristige Beschäftigung Haushaltshilfe Mehrere Jobs Rentenversicherungspflicht Arbeitsrechte, Minijob Urlaubsanspruch, Minijob Versicherungen Sonderfälle, Ausland Rentner Studenten Schüler Arbeitslose Personen Menschen, Behinderung Midijob Minijob, Haushaltshilfe, Gewerbe, Für Gewerbetreibende Für Gewerbetreibende Abgaben, Steuern Beitragszahlung, Fristen, Minijobs Jahresmeldung, Schwankender Verdienst, Fristen Unfall, Mutterschaft Pflege, Haushalte Service Service Kontakt Formulare, Häufige Fragen Broschüren, Rechner Schaubilder, Prüfhilfen Videos, Magazin Suchbegriff Häufig, Kontakt Halbjahresscheck Arbeitsvertrag Toggle Menu Menü Suchbegriff Häufig, Kontakt Halbjahresscheck Arbeitsvertrag, Menü Die Minijobs Zurück Die Minijobs Minijob, Verdienstgrenze Kurzfristige Beschäftigung Haushaltshilfe Mehrere Jobs Rentenversicherungspflicht Arbeitsrechte, Minijob Urlaubsanspruch, Minijob Versicherungen Sonderfälle, Ausland Rentner Studenten Schüler Arbeitslose Personen Menschen, Behinderung Midijob Minijob, Zurück Minijob, Minijob, Gewerbe, Für Gewerbetreibende Zurück Für Gewerbetreibende Abgaben, Steuern Beitragszahlung, Fristen, Minijobs Jahresmeldung, Schwankender Verdienst, Fristen Unfall, Mutterschaft Pflege, Haushalte Service Zurück Service Kontakt Formulare, Häufige Fragen Broschüren, Rechner Schaubilder, Prüfhilfen Videos, Magazin English Gebärdensprache Leichte Sprache Magazin Tipps, Alltagshelden Die, Babysitter Die Sommerferien, Schüler, Wochen, Ferien, Deswegen, Schützlinge, Kinderbetreuung, Warum, Aufgabe, Nebenjob, Kinderbetreuung, Eine Reise, Gute Bezahlung, Viele Stunden, Rutsch, Den Sommer, Auf, Kontakte, Kein Platz, Nach, Beitrag, Dankbarkeit, Wertschätzung Wo Sie, Teilen Kopiert, Eine Reise, Kindheit Sie, Spaß, Ihren Kindheitszeiten, Spielen, Basteln, Spielplatz, Eis, Perfekt, Kind, Gute Bezahlung Für, Kinder, Eltern, Beispiel, Betreuungsperson, Sympathie, Umgang, Beispiel, Elternteil, Das, Ihren Verdienst, Der Stundenlohn, Erfahrung, Wohnort, Viele Stunden, Als Kinderbetreuer, Kinderbetreuerin, Ihnen, Arbeit, Kinder, Hause, Eltern, Stunden, Dafür, Minijob, Stück, Den Sommer, Arbeitszeit Im Sommer, Hitze, Büro, See, Balkon, Babysitterin, Denn, Badesee, Spielplatz, Eisdiele, Ihren Aufgaben, Ausflüge, Kindern, Arbeit, Auf, Kontakte, Menschen, Nicht, Kinderbetreuungen, Beispiel, Park, Dieser Minijob, Kontakte, Menschen, Freundschaften, Kein Platz, Langeweile Kaum, Denn Sie, Ihre Arbeitstage, Kindern, Ihren Ideen, Raum, Eltern, Sie Engagement, Ausflüge, Kindern, Sie, Sie, Nach, Pause Obwohl Sie, Menschen, Momente, Denn, Ausflügen, Kinder, Erholung, Kinderbetreuung, Abenteuerspielplatz, Waldspaziergang, Auge, Ihre Schützlinge, Lesen Sie, Beitrag, Kinder Kinderbetreuung, Beitrag, Verhaltensbeispiel, Kinder, Ihren Schützlingen Werte, Kinder, Kompetenzen Durch, Kinderbetreuer, Kontakt, Sie Kommunikationsfähigkeit, Empathievermögen, Hilfsbereitschaft, Ihre, Umgang, Menschen, Dankbarkeit, Wertschätzung Das, Babysitter, Eine Kinderbetreuung, Alltag, Eltern, Kinderbetreuung, Chancen, Eltern Sie, Ferien, Alltag, Sie, Vorteilen, Kinderbetreuung, Babysitterin, Dann, Sie, Anzeige, Haben Sie Erfahrung, Babysitter, Dann, Sie, Artikel, Sie, Nein Hilfe, Kontakt Sie, Dann, Sie, Das, Sie, Arbeit, Diese, Hilfe, Haushalt, Haushalt, Sie, Hände, Eine, Ihnen, Die, Sobald Arbeitgeberinnen, Spiel, Alle Artikel, Benachrichtigungen, Antworten, Label Vorname Nachname, Benachrichtigungen, Antworten, Inline Feedbacks View, Seite, Seite, Teilen Kopiert, Häufige Fragen Barrierefreiheit Kontakt Barriere, Bildnachweise, Teil, Verbundsystems, Deutschen Rentenversicherung"
"Babysits","https://www.babysits.at/babysitting/wien/","babysitter","","","","Babysitter, Babysits Babysits Wien Babysitter Babysitter Jobs Schnell, Babysitter, Babysitter Job, Nähe, Einloggen Registrieren Konto Trete Babysits, Anmelden, Registrieren Die App, Unterstützung Tipps, Artikel So, Vertrauen, Sicherheit Hilfe, Babysitter Tagesmutter, Kinder Baby Kleinkind Kindergartenkind Schulkind Teenager, Referenzen Mehr, Nähe, Babysitter Jobs, Melde, Gokhan Babysitter Job, Deutsch, Kinder, Kinder, Kindergartenkind Letzte Aktivität, Gestern Buchungen, Lucia Babysitter Job, Mein Sohn, Baby, Person, Luis, Kinder, Kinder, Kleinkind, Baby Letzte Aktivität, Gestern, Ivonne Neu Nanny Job, Kinder, Kinder, Schulkind, Alevtyna Babysitter Job, Kinder, Kinder, Kleinkind Letzte Aktivität, Woche, Alexandra Babysitter Job, Familie, Beide Kinder, Suche, Verlässlichen, Sohn, Kinder, Kinder, Schulkind Letzte Aktivität, Lara Neu Babysitter Job, Familie, Wir, Babysitter, Kinder, Kinder, Kindergartenkind Letzte Aktivität, Philipp Neu Babysitter Job, Jahr, David, Beide, Umfeld, Meine Freundin, Kinder, Kinder, Kleinkind, Shay Babysitter Job, Unsere Tochter, Wir, Kinder, Kinder, Baby Letzte Aktivität, Kinder, Kinder, Baby Letzte Aktivität, Katerina Babysitter Job, Familie, Babysitter, Baby, Wir, Wert, Kinder, Kinder, Baby, Woche, Zlatko Babysitter Job, Kinder, Kinder, Baby, Woche, Sarah Babysitter Job, Jährige Tochter, Puppen, Spielplatz, Kinder, Kinder, Kleinkind, Baby Letzte Aktivität, Babysitter Job, Kinder, Kinder, Schulkind Letzte Aktivität, Gestern, Babysitter Job, Familie, Babysitter, Wir, Kinder, Kinder, Kindergartenkind Letzte Aktivität, Wochen, Babysitter Job, Kinder, Kinder, Kleinkind Letzte Aktivität, Babysitter Job Wien Wird, Mehr Filter Sortieren Relevanz Relevanz Letzte Aktivität Mitglied, Bewertung Art, Kinder Baby Kleinkind Kindergartenkind Schulkind Teenager Verifizierungen Lichtbildausweis Hat Bewertungen, Referenzen Wenn, Babysitter, Mittags Nachmittags Abends Bevorzugter Ort, Babysitten Bei, Familie Beim Babysitter Mindestlohn, Stunde, Suche, Benötigt, Babysitter, Haustiere Kochen Hausarbeiten Hausaufgabenbetreuung Gesprochene Sprache German English French Spanish Italian Hungarian Portuguese Zeige, Gebärdensprache Abkhazian Achinese Acoli Adangme Adyghe Afar Afrikaans Ainu Akan Albanian Aleut Amharic Angika Arabic Aramaic Arawak Armenian Assamese Asturian Avaric Awadhi Aymara Azerbaijani Balinese Baluchi Bambara Bangla Basaa Bashkir Basque Beja Belarusian Bemba Bhojpuri Bikol Bini Bislama Bosnian Braj Breton Buginese Bulgarian Buriat Burmese Carib Catalan Cebuano Chagatai Chamorro Chechen Cherokee Chinese Choctaw Chuukese Chuvash Classical Newari Classical Syriac Cornish Corsican Cree Crimean Tatar Croatian Czech Danish Dargwa Dinka Divehi Dogri Dutch Dyula Dzongkha Efik Esperanto Estonian Ewe Ewondo Fang Fanti Faroese Fijian Filipino Finnish Fon Friulian Fula Ga Galician Ganda Gayo Gbaya Georgian Gilbertese Gondi Gorontalo Grebo Greek Guarani Gujarati Haitian Creole Hausa Hawaiian Hebrew Herero Hiligaynon Hindi Hiri Motu Hmong Iban Icelandic Igbo Iloko Indonesian Ingush Inuktitut Irish Japanese Javanese Kabardian Kabuverdianu Kabyle Kachin Kalaallisut Kamba Kannada Kanuri, Kashubian Kawi Kazakh Khasi Khmer Kikuyu Kimbundu Kinyarwanda Kongo Konkani Korean Kpelle Kuanyama Kumyk Kurdish Kurukh Kyrgyz Lamba Lao Latin Latvian Lezghian Limburgish Lingala Lithuanian Low German Lozi, Macedonian Madurese Magahi Maithili Makasar Malagasy Malay Malayalam Maltese Mandar Mandingo Manipuri Mapuche Marathi Mari Marshallese Marwari Masai Mende Minangkabau Mirandese Mizo Mongolian Morisyen Mossi Muscogee Māori Nauru Navajo Ndonga Neapolitan Nepali Newari Nias Niuean Nogai North Ndebele Northern Frisian Northern Sami Northern Sotho Norwegian Norwegian Nynorsk Nyamwezi Nyanja Nyankole Nyasa Tonga Nyoro Nzima, Occitan Odia Ojibwa Oromo Ossetic Palauan Pampanga Pangasinan Papiamento Pashto Persian Pohnpeian Polish Punjabi Quechua Rajasthani Rarotongan Romanian Romansh Romany Rundi Russian Samoan Sandawe Sango Santali Sardinian Sasak Scots Scottish Gaelic Serbian Serer Shan Shona Sichuan Yi Sicilian Sidamo Sindhi Sinhala Slovak Slovenian Somali Soninke South Ndebele Southern Sotho Sranan Tongo Standard Moroccan Tamazight Sukuma Sundanese Susu Swahili Swati Swedish Swiss German Syriac Tagalog Tahitian Tajik Tamashek Tamil Tatar Telugu Tetum Thai Tibetan Tigre Tigrinya Timne Tiv Tok Pisin Tokelau Tongan Tsonga Tswana Tumbuka Turkish Turkmen Tuvalu Tuvinian Twi Udmurt Ukrainian Umbundu Upper Sorbian Urdu Uyghur Uzbek Vai Venda Vietnamese Walloon Waray Welsh Western Frisian Western Panjabi Wolaytta Wolof Xhosa Yakut Yao Yiddish Yoruba Zapotec Zaza, Zhuang Zulu, Finde, Suche Filter, Kontakt Sende Nachrichten, Sicher, Kontakt Sende Nachrichten, Babysittertermin, Ausgaben, Melde, Fragen Wie, Durchschnitt, Stundenlohn, Babysitter, Nutzung, Babysitter, Babysitter, Familien, Babysitterjobs, Gedanken, Lohn, Welche Aktivitäten, Babysitten, App Store Google Play Babysits, Millionen Mitglieder, Babysitter, Alltag, Vätern, Hause Hilfe, Nerina Diese Anwendung, Gefühl, Giovanna Es, Jahr, Arbeit, Ana Die Anwendung, Sehr, Amanda Es, Lebensunterhalt, Erfahrung, Kindern, Stefany Melde, Babysitter Jobs, Nähe Klosterneuburg Schwechat Gerasdorf, Wien Langenzersdorf Vösendorf Leopoldsdorf Weidling Rannersdorf Hennersdorf Kledering Babysitter Jobs, Siedlung Augustinerwald Mühlberg, Schalzbachvorsäß Hinterhainbach Kaiserebersdorf Freudenau Kaisermühlen Neukagran Bellevue Karte Liste, Babysits Anmelden, Registrieren, Haken, Mensch, Einloggen Passwort, Vorname Nachname Stell, Ausweis, Updates, Konto, Passwort Setze, Haken, Mensch, Erlebnis, Leistung, Website, Wir, Verwendung, Sammeln, Mehr, Argentina Australia Austria Belgium Belize Bolivia Brazil Bulgaria Canada Chile Colombia Costa Rica Croatia Cyprus Czechia Denmark Dominican Republic Ecuador El Salvador Estonia Ethiopia Finland France French Guiana Germany Ghana Greece Greenland Guatemala Guyana Honduras Hong Kong SAR China Hungary Iceland India Indonesia Ireland Israel Italy Jamaica Japan Kenya Latvia Liechtenstein Lithuania Luxembourg Malaysia Malta Mauritius Mexico Moldova Morocco Netherlands New Zealand Nicaragua Nigeria Norway Panama Paraguay Peru Philippines Poland Portugal Puerto Rico Qatar Romania Saudi Arabia Serbia Singapore Slovakia Slovenia South Africa South Korea Spain Sri Lanka Suriname Sweden Switzerland Taiwan Tanzania Trinidad, Tobago Türkiye Uganda Ukraine United, Arab Emirates United Kingdom United, States Uruguay Venezuela Vietnam German English German Babysits So, Hilfe Bedingungen, Datenschutz Preise Impressum Babysits, Berufstätige Babysits Shop Entdecke, Artikel Vertrauen, Sicherheit Community Leitfaden Partner Babysits, Bedürfnisse Beliebt Babysitter Wien Babysitter Graz Babysitter Linz Babysitter Salzburg Babysitter Innsbruck Babysitter Jobs Folge, Babysits"
"Sittertree","https://www.sittertree.com/","babysitter","","","","Book, Skip, Login Sign Up, Download, Google Play Navigation, Login Book, Book, Get, Book, Katie G., Sauda F., Babysitter Simple, View, Get, Churches Try, Name Email, Facebook Connect, Linkedin SitterTree, Join SitterTree Sitters Parents Churches, Privacy Safety Sitter Help Parent Help Group Help Join Us Culture Careers Gift Cards Contact Company About Blog"
"Focus","https://praxistipps.focus.de/babysitten-die-besten-tipps-und-tricks_104550","babysitter","2018 15","","","Tipps, Tricks, Tipps, Amelie, Die Kinderbetreuung, Welche Tipps Sie, Ihnen, Klicks Die, Symbol, Links, Erfolgt, Einkauf, Sie, Die, Auswahl, Ihr Klick, Finanzierung, Babysitten, Mal, Punkte, Babysitter, Roten Kreuz, Treffen, Wenn Ihnen, Kennenlernen, Kindern, Kontakt, Nehmen Sie, Ihrer, Sicherheit, Bezugsperson Ihrer Wahl, Treffen, Achten Sie, Nehmen Sie, Treffen Zeit, Familie, Trauen Sie, Fragen, Vorlieben, Abneigungen, Familie, Gehen Sie, Kind, Sie, Harmonieren Sie, Kind, Schande, Babysitter, Kleinkind, Babysitten, Menge Spaß, Bild, Tricks, Sie, Familie, Kind, Bilde, Wir, Tipps, Tricks, Babysitten, Bevor, Schreiben Sie, Vereinbaren Sie, Regeln, Welche Dinge, Haus, Schaffen Sie Klarheit, Tür, Familie, Erkundigen Sie, Utensilien, Bringen Sie, Schenken Sie, Kind, Babysitten Ihre, Sie Ihr Smartphone, Gehen Sie, Spiele, Eltern, Zögern Sie, Halten Sie, Schlafrhythmus, Schicken Sie, Kind, Bett, Nutzen Sie, Zeit, Eltern, Wenn Sie, Babysitten, Beruf, Baby Apps, Aktuell, Kay Julius, Kästchen, Kästchen, Die Regeln, Die Regeln, Familie, Familie, Sie, Herd, Herd, Lösungen Mutter, Vater Freistellung, Gesetze Entschuldigung, Sie, Wie, Ein Richtwert, Selbstbefriedigung, Überblick Schwangerschaft, Baby, Bauch, Ursachen, Bedeutung Weitere, Tipps Neueste, Kindern, Verlust Beerdigung, Die Bestattungsform, Warum, Tabuthema, Tröstende Worte, Sie, Ich, Menschen, Krisenvorsorge, Vorsorge Weitere, Tipps Die"
"Uni-Marburg","https://babysitterboerse.online.uni-marburg.de/impressum","babysitter","06421 28-20, 06421 28-22500, 112590692, 2565185, +49 6421 28-26402, +49 6421 28-26490, +49 6421 28-26402, +49 6421 28-26490","info@uni-marburg.de, pressestelle@uni-marburg.de, familie@verwaltung.uni-marburg.de, familie@verwaltung.uni-marburg.de","NaussBiegenstraße 10, 35037 MarburgTel","Impressum, Marburg Direkt, Marburg, Kontrastreiche Version, Marburg, Marburg, Babysitter, Kontakt Nutzung, Babysitterbörse Babysitter, Marburg Betreuungsbörse, Marburg Betreuungsbörse, Babysitter, Kontakt Nutzung, Babysitterbörse Babysitter, Babysitterbörse Impressum Impressum, Impressum Diensteanbieter Anbieter, Marburg, Der PräsidentProf, Thomas, Körperschaft, Zuständige Aufsichtsbehörde Hessisches Ministerium, Schumacher, Brand, Verena, Michael Schumacher GbR, Barrierefreiheit, Marburg Haftung, Inhalte Als, Seiten, Gesetzen, Nach, Nutzung, Gesetzen, Eine, Haftung, Zeitpunkt, Kenntnis, Rechtsverletzung, Bei Bekanntwerden, Haftung, Links Unser Angebot, Links, Webseiten Dritter, Inhalte, Einfluss, Deshalb, Gewähr, Seiten, Zeitpunkt, Rechtsverstöße, Rechtswidrige Inhalte, Verlinkung, Eine, Kontrolle, Bei Bekanntwerden, Urheberrecht Die, Inhalte, Seiten, Die Vervielfältigung, Urheberrechtes, Downloads, Seite, Soweit, Seite, Urheberrechte Dritter, Inhalte Dritter, Sollten Sie, Urheberrechtsverletzung, Bei Bekanntwerden, Inhalte, Datenschutz Soweit, Anschrift, Die Nutzung, Angabe, Daten, Der Nutzung, Impressumspflicht, Dritte, Werbung, Die Betreiber, Seiten, Schritte, Falle, Quelle, Kontakt, Marburg Betreuungsbörse, Marburg Bunsenstraße, Kontakt, Impressum Datenschutz Nutzungsbedingungen Barrierefreiheit Gütesiegel Familienfreundliche Hochschule Land Hessen Kontaktinformationen Betreuungsbörse, Marburg Betreuungsbörse, Marburg Bunsenstraße, Kontakt, Gütesiegel Familienfreundliche Hochschule Land Hessen"
